cutlass/conv2d-2080.csv
,Problem,Provider,OperationKind,Operation,Disposition,Status,conv_kind,n,h,w,c,k,r,s,p,q,pad_h,pad_w,stride_h,stride_w,dilation_h,dilation_w,Activation,Filter,Output,conv_mode,iterator_algorithm,alpha,beta,split_k_mode,split_k_slices,eq_gemm_provider,op_class,accum,cta_m,cta_n,cta_k,stages,warps_m,warps_n,warps_k,inst_m,inst_n,inst_k,min_cc,max_cc,Bytes,Flops,Flops/Byte,Runtime,GB/s,GFLOPs
0,1,CUTLASS,conv2d,cutlass_simt_sfprop_optimized_128x128_8x2_nhwc_align1,passed,success,fprop,1,110,110,3,32,3,3,108,108,0,0,1,1,1,1,f32:nhwc,f32:nhwc,f32:nhwc,cross,optimized,1,0,serial,1,none,simt,f32,128,128,8,2,4,2,1,1,1,1,50,1024,2756160,20901888,7,0.0452509,56.7254,461.911
1,1,CUTLASS,conv2d,cutlass_simt_sfprop_optimized_128x64_8x2_nhwc_align1,passed,success,fprop,1,110,110,3,32,3,3,108,108,0,0,1,1,1,1,f32:nhwc,f32:nhwc,f32:nhwc,cross,optimized,1,0,serial,1,none,simt,f32,128,64,8,2,2,2,1,1,1,1,50,1024,2756160,20901888,7,0.0254774,100.751,820.408
2,1,CUTLASS,conv2d,cutlass_simt_sfprop_optimized_64x128_8x2_nhwc_align1,passed,success,fprop,1,110,110,3,32,3,3,108,108,0,0,1,1,1,1,f32:nhwc,f32:nhwc,f32:nhwc,cross,optimized,1,0,serial,1,none,simt,f32,64,128,8,2,2,2,1,1,1,1,50,1024,2756160,20901888,7,0.0327219,78.4451,638.773
3,1,CUTLASS,conv2d,cutlass_simt_sfprop_optimized_64x64_8x2_nhwc_align1,passed,success,fprop,1,110,110,3,32,3,3,108,108,0,0,1,1,1,1,f32:nhwc,f32:nhwc,f32:nhwc,cross,optimized,1,0,serial,1,none,simt,f32,64,64,8,2,2,1,1,1,1,1,50,1024,2756160,20901888,7,0.0252845,101.52,826.669
4,1,CUTLASS,conv2d,cutlass_simt_sfprop_optimized_128x32_8x2_nhwc_align1,passed,success,fprop,1,110,110,3,32,3,3,108,108,0,0,1,1,1,1,f32:nhwc,f32:nhwc,f32:nhwc,cross,optimized,1,0,serial,1,none,simt,f32,128,32,8,2,2,1,1,1,1,1,50,1024,2756160,20901888,7,0.0275597,93.1387,758.423
5,1,CUTLASS,conv2d,cutlass_simt_sfprop_optimized_32x128_8x2_nhwc_align1,passed,success,fprop,1,110,110,3,32,3,3,108,108,0,0,1,1,1,1,f32:nhwc,f32:nhwc,f32:nhwc,cross,optimized,1,0,serial,1,none,simt,f32,32,128,8,2,1,2,1,1,1,1,50,1024,2756160,20901888,7,0.0355766,72.1505,587.517
0,1,CUTLASS,conv2d,cutlass_simt_sfprop_optimized_128x128_8x2_nhwc_align1,passed,success,fprop,1,110,110,32,32,3,3,108,108,0,0,1,1,1,1,f32:nhwc,f32:nhwc,f32:nhwc,cross,optimized,1,0,serial,1,none,simt,f32,128,128,8,2,4,2,1,1,1,1,50,1024,14966784,215737344,14,0.142768,97.633,1511.1
1,1,CUTLASS,conv2d,cutlass_simt_sfprop_optimized_128x64_8x2_nhwc_align1,passed,success,fprop,1,110,110,32,32,3,3,108,108,0,0,1,1,1,1,f32:nhwc,f32:nhwc,f32:nhwc,cross,optimized,1,0,serial,1,none,simt,f32,128,64,8,2,2,2,1,1,1,1,50,1024,14966784,215737344,14,0.0776973,179.4,2776.64
2,1,CUTLASS,conv2d,cutlass_simt_sfprop_optimized_64x128_8x2_nhwc_align1,passed,success,fprop,1,110,110,32,32,3,3,108,108,0,0,1,1,1,1,f32:nhwc,f32:nhwc,f32:nhwc,cross,optimized,1,0,serial,1,none,simt,f32,64,128,8,2,2,2,1,1,1,1,50,1024,14966784,215737344,14,0.106928,130.358,2017.6
3,1,CUTLASS,conv2d,cutlass_simt_sfprop_optimized_64x64_8x2_nhwc_align1,passed,success,fprop,1,110,110,32,32,3,3,108,108,0,0,1,1,1,1,f32:nhwc,f32:nhwc,f32:nhwc,cross,optimized,1,0,serial,1,none,simt,f32,64,64,8,2,2,1,1,1,1,1,50,1024,14966784,215737344,14,0.0781728,178.309,2759.75
4,1,CUTLASS,conv2d,cutlass_simt_sfprop_optimized_128x32_8x2_nhwc_align1,passed,success,fprop,1,110,110,32,32,3,3,108,108,0,0,1,1,1,1,f32:nhwc,f32:nhwc,f32:nhwc,cross,optimized,1,0,serial,1,none,simt,f32,128,32,8,2,2,1,1,1,1,1,50,1024,14966784,215737344,14,0.0850227,163.943,2537.41
5,1,CUTLASS,conv2d,cutlass_simt_sfprop_optimized_32x128_8x2_nhwc_align1,passed,success,fprop,1,110,110,32,32,3,3,108,108,0,0,1,1,1,1,f32:nhwc,f32:nhwc,f32:nhwc,cross,optimized,1,0,serial,1,none,simt,f32,32,128,8,2,1,2,1,1,1,1,50,1024,14966784,215737344,14,0.114337,121.911,1886.86
0,1,CUTLASS,conv2d,cutlass_simt_sfprop_optimized_128x128_8x2_nhwc_align1,passed,success,fprop,1,56,56,32,64,3,3,54,54,0,0,1,1,1,1,f32:nhwc,f32:nhwc,f32:nhwc,cross,optimized,1,0,serial,1,none,simt,f32,128,128,8,2,4,2,1,1,1,1,50,1024,4179456,107868672,25,0.0720947,53.9904,1496.21
1,1,CUTLASS,conv2d,cutlass_simt_sfprop_optimized_128x64_8x2_nhwc_align1,passed,success,fprop,1,56,56,32,64,3,3,54,54,0,0,1,1,1,1,f32:nhwc,f32:nhwc,f32:nhwc,cross,optimized,1,0,serial,1,none,simt,f32,128,64,8,2,2,2,1,1,1,1,50,1024,4179456,107868672,25,0.044735,87.0106,2411.28
2,1,CUTLASS,conv2d,cutlass_simt_sfprop_optimized_64x128_8x2_nhwc_align1,passed,success,fprop,1,56,56,32,64,3,3,54,54,0,0,1,1,1,1,f32:nhwc,f32:nhwc,f32:nhwc,cross,optimized,1,0,serial,1,none,simt,f32,64,128,8,2,2,2,1,1,1,1,50,1024,4179456,107868672,25,0.0428858,90.7626,2515.26
3,1,CUTLASS,conv2d,cutlass_simt_sfprop_optimized_64x64_8x2_nhwc_align1,passed,success,fprop,1,56,56,32,64,3,3,54,54,0,0,1,1,1,1,f32:nhwc,f32:nhwc,f32:nhwc,cross,optimized,1,0,serial,1,none,simt,f32,64,64,8,2,2,1,1,1,1,1,50,1024,4179456,107868672,25,0.0440608,88.3421,2448.18
4,1,CUTLASS,conv2d,cutlass_simt_sfprop_optimized_128x32_8x2_nhwc_align1,passed,success,fprop,1,56,56,32,64,3,3,54,54,0,0,1,1,1,1,f32:nhwc,f32:nhwc,f32:nhwc,cross,optimized,1,0,serial,1,none,simt,f32,128,32,8,2,2,1,1,1,1,1,50,1024,4179456,107868672,25,0.0520906,74.7241,2070.79
5,1,CUTLASS,conv2d,cutlass_simt_sfprop_optimized_32x128_8x2_nhwc_align1,passed,success,fprop,1,56,56,32,64,3,3,54,54,0,0,1,1,1,1,f32:nhwc,f32:nhwc,f32:nhwc,cross,optimized,1,0,serial,1,none,simt,f32,32,128,8,2,1,2,1,1,1,1,50,1024,4179456,107868672,25,0.0751053,51.8262,1436.23
0,1,CUTLASS,conv2d,cutlass_simt_sfprop_optimized_128x128_8x2_nhwc_align1,passed,success,fprop,1,56,56,64,64,3,3,54,54,0,0,1,1,1,1,f32:nhwc,f32:nhwc,f32:nhwc,cross,optimized,1,0,serial,1,none,simt,f32,128,128,8,2,4,2,1,1,1,1,50,1024,7612416,215364096,28,0.135237,52.4236,1592.49
1,1,CUTLASS,conv2d,cutlass_simt_sfprop_optimized_128x64_8x2_nhwc_align1,passed,success,fprop,1,56,56,64,64,3,3,54,54,0,0,1,1,1,1,f32:nhwc,f32:nhwc,f32:nhwc,cross,optimized,1,0,serial,1,none,simt,f32,128,64,8,2,2,2,1,1,1,1,50,1024,7612416,215364096,28,0.0811072,87.4104,2655.3
2,1,CUTLASS,conv2d,cutlass_simt_sfprop_optimized_64x128_8x2_nhwc_align1,passed,success,fprop,1,56,56,64,64,3,3,54,54,0,0,1,1,1,1,f32:nhwc,f32:nhwc,f32:nhwc,cross,optimized,1,0,serial,1,none,simt,f32,64,128,8,2,2,2,1,1,1,1,50,1024,7612416,215364096,28,0.0784912,90.3237,2743.8
3,1,CUTLASS,conv2d,cutlass_simt_sfprop_optimized_64x64_8x2_nhwc_align1,passed,success,fprop,1,56,56,64,64,3,3,54,54,0,0,1,1,1,1,f32:nhwc,f32:nhwc,f32:nhwc,cross,optimized,1,0,serial,1,none,simt,f32,64,64,8,2,2,1,1,1,1,1,50,1024,7612416,215364096,28,0.0801802,88.4211,2686.0
4,1,CUTLASS,conv2d,cutlass_simt_sfprop_optimized_128x32_8x2_nhwc_align1,passed,success,fprop,1,56,56,64,64,3,3,54,54,0,0,1,1,1,1,f32:nhwc,f32:nhwc,f32:nhwc,cross,optimized,1,0,serial,1,none,simt,f32,128,32,8,2,2,1,1,1,1,1,50,1024,7612416,215364096,28,0.095256,74.427,2260.9
5,1,CUTLASS,conv2d,cutlass_simt_sfprop_optimized_32x128_8x2_nhwc_align1,passed,success,fprop,1,56,56,64,64,3,3,54,54,0,0,1,1,1,1,f32:nhwc,f32:nhwc,f32:nhwc,cross,optimized,1,0,serial,1,none,simt,f32,32,128,8,2,1,2,1,1,1,1,50,1024,7612416,215364096,28,0.142666,49.6937,1509.57
0,1,CUTLASS,conv2d,cutlass_simt_sfprop_optimized_128x128_8x2_nhwc_align1,passed,success,fprop,1,29,29,64,128,3,3,27,27,0,0,1,1,1,1,f32:nhwc,f32:nhwc,f32:nhwc,cross,optimized,1,0,serial,1,none,simt,f32,128,128,8,2,4,2,1,1,1,1,50,1024,2347776,107682048,45,0.135634,16.1209,793.919
1,1,CUTLASS,conv2d,cutlass_simt_sfprop_optimized_128x64_8x2_nhwc_align1,passed,success,fprop,1,29,29,64,128,3,3,27,27,0,0,1,1,1,1,f32:nhwc,f32:nhwc,f32:nhwc,cross,optimized,1,0,serial,1,none,simt,f32,128,64,8,2,2,2,1,1,1,1,50,1024,2347776,107682048,45,0.0816243,26.7878,1319.24
2,1,CUTLASS,conv2d,cutlass_simt_sfprop_optimized_64x128_8x2_nhwc_align1,passed,success,fprop,1,29,29,64,128,3,3,27,27,0,0,1,1,1,1,f32:nhwc,f32:nhwc,f32:nhwc,cross,optimized,1,0,serial,1,none,simt,f32,64,128,8,2,2,2,1,1,1,1,50,1024,2347776,107682048,45,0.0768774,28.4419,1400.7
3,1,CUTLASS,conv2d,cutlass_simt_sfprop_optimized_64x64_8x2_nhwc_align1,passed,success,fprop,1,29,29,64,128,3,3,27,27,0,0,1,1,1,1,f32:nhwc,f32:nhwc,f32:nhwc,cross,optimized,1,0,serial,1,none,simt,f32,64,64,8,2,2,1,1,1,1,1,50,1024,2347776,107682048,45,0.0799354,27.3538,1347.11
4,1,CUTLASS,conv2d,cutlass_simt_sfprop_optimized_128x32_8x2_nhwc_align1,passed,success,fprop,1,29,29,64,128,3,3,27,27,0,0,1,1,1,1,f32:nhwc,f32:nhwc,f32:nhwc,cross,optimized,1,0,serial,1,none,simt,f32,128,32,8,2,2,1,1,1,1,1,50,1024,2347776,107682048,45,0.0952074,22.966,1131.03
5,1,CUTLASS,conv2d,cutlass_simt_sfprop_optimized_32x128_8x2_nhwc_align1,passed,success,fprop,1,29,29,64,128,3,3,27,27,0,0,1,1,1,1,f32:nhwc,f32:nhwc,f32:nhwc,cross,optimized,1,0,serial,1,none,simt,f32,32,128,8,2,1,2,1,1,1,1,50,1024,2347776,107682048,45,0.0879782,24.8532,1223.96
0,1,CUTLASS,conv2d,cutlass_simt_sfprop_optimized_128x128_8x2_nhwc_align1,passed,success,fprop,1,29,29,128,128,3,3,27,27,0,0,1,1,1,1,f32:nhwc,f32:nhwc,f32:nhwc,cross,optimized,1,0,serial,1,none,simt,f32,128,128,8,2,4,2,1,1,1,1,50,1024,4322304,215177472,49,0.263609,15.2706,816.275
1,1,CUTLASS,conv2d,cutlass_simt_sfprop_optimized_128x64_8x2_nhwc_align1,passed,success,fprop,1,29,29,128,128,3,3,27,27,0,0,1,1,1,1,f32:nhwc,f32:nhwc,f32:nhwc,cross,optimized,1,0,serial,1,none,simt,f32,128,64,8,2,2,2,1,1,1,1,50,1024,4322304,215177472,49,0.155993,25.8053,1379.4
2,1,CUTLASS,conv2d,cutlass_simt_sfprop_optimized_64x128_8x2_nhwc_align1,passed,success,fprop,1,29,29,128,128,3,3,27,27,0,0,1,1,1,1,f32:nhwc,f32:nhwc,f32:nhwc,cross,optimized,1,0,serial,1,none,simt,f32,64,128,8,2,2,2,1,1,1,1,50,1024,4322304,215177472,49,0.147294,27.3294,1460.87
3,1,CUTLASS,conv2d,cutlass_simt_sfprop_optimized_64x64_8x2_nhwc_align1,passed,success,fprop,1,29,29,128,128,3,3,27,27,0,0,1,1,1,1,f32:nhwc,f32:nhwc,f32:nhwc,cross,optimized,1,0,serial,1,none,simt,f32,64,64,8,2,2,1,1,1,1,1,50,1024,4322304,215177472,49,0.153019,26.3069,1406.22
4,1,CUTLASS,conv2d,cutlass_simt_sfprop_optimized_128x32_8x2_nhwc_align1,passed,success,fprop,1,29,29,128,128,3,3,27,27,0,0,1,1,1,1,f32:nhwc,f32:nhwc,f32:nhwc,cross,optimized,1,0,serial,1,none,simt,f32,128,32,8,2,2,1,1,1,1,1,50,1024,4322304,215177472,49,0.182932,22.0053,1176.27
5,1,CUTLASS,conv2d,cutlass_simt_sfprop_optimized_32x128_8x2_nhwc_align1,passed,success,fprop,1,29,29,128,128,3,3,27,27,0,0,1,1,1,1,f32:nhwc,f32:nhwc,f32:nhwc,cross,optimized,1,0,serial,1,none,simt,f32,32,128,8,2,1,2,1,1,1,1,50,1024,4322304,215177472,49,0.168789,23.849,1274.83
0,1,CUTLASS,conv2d,cutlass_simt_sfprop_optimized_128x128_8x2_nhwc_align1,passed,success,fprop,1,230,230,3,64,7,7,112,112,0,0,2,2,1,1,f32:nhwc,f32:nhwc,f32:nhwc,cross,optimized,1,0,serial,1,none,simt,f32,128,128,8,2,4,2,1,1,1,1,50,1024,10624768,237633536,22,0.186549,53.0427,1273.84
1,1,CUTLASS,conv2d,cutlass_simt_sfprop_optimized_128x64_8x2_nhwc_align1,passed,success,fprop,1,230,230,3,64,7,7,112,112,0,0,2,2,1,1,f32:nhwc,f32:nhwc,f32:nhwc,cross,optimized,1,0,serial,1,none,simt,f32,128,64,8,2,2,2,1,1,1,1,50,1024,10624768,237633536,22,0.103615,95.4988,2293.43
2,1,CUTLASS,conv2d,cutlass_simt_sfprop_optimized_64x128_8x2_nhwc_align1,passed,success,fprop,1,230,230,3,64,7,7,112,112,0,0,2,2,1,1,f32:nhwc,f32:nhwc,f32:nhwc,cross,optimized,1,0,serial,1,none,simt,f32,64,128,8,2,2,2,1,1,1,1,50,1024,10624768,237633536,22,0.140861,70.2469,1687.0
3,1,CUTLASS,conv2d,cutlass_simt_sfprop_optimized_64x64_8x2_nhwc_align1,passed,success,fprop,1,230,230,3,64,7,7,112,112,0,0,2,2,1,1,f32:nhwc,f32:nhwc,f32:nhwc,cross,optimized,1,0,serial,1,none,simt,f32,64,64,8,2,2,1,1,1,1,1,50,1024,10624768,237633536,22,0.102434,96.5997,2319.87
4,1,CUTLASS,conv2d,cutlass_simt_sfprop_optimized_128x32_8x2_nhwc_align1,passed,success,fprop,1,230,230,3,64,7,7,112,112,0,0,2,2,1,1,f32:nhwc,f32:nhwc,f32:nhwc,cross,optimized,1,0,serial,1,none,simt,f32,128,32,8,2,2,1,1,1,1,1,50,1024,10624768,237633536,22,0.118655,83.3937,2002.73
5,1,CUTLASS,conv2d,cutlass_simt_sfprop_optimized_32x128_8x2_nhwc_align1,passed,success,fprop,1,230,230,3,64,7,7,112,112,0,0,2,2,1,1,f32:nhwc,f32:nhwc,f32:nhwc,cross,optimized,1,0,serial,1,none,simt,f32,32,128,8,2,1,2,1,1,1,1,50,1024,10624768,237633536,22,0.20087,49.2611,1183.02
0,1,CUTLASS,conv2d,cutlass_simt_sfprop_optimized_128x128_8x2_nhwc_align1,passed,success,fprop,1,16,16,256,512,3,3,7,7,0,0,2,2,1,1,f32:nhwc,f32:nhwc,f32:nhwc,cross,optimized,1,0,serial,1,none,simt,f32,128,128,8,2,4,2,1,1,1,1,50,1024,5270528,115655680,21,0.517477,9.48557,223.499
1,1,CUTLASS,conv2d,cutlass_simt_sfprop_optimized_128x64_8x2_nhwc_align1,passed,success,fprop,1,16,16,256,512,3,3,7,7,0,0,2,2,1,1,f32:nhwc,f32:nhwc,f32:nhwc,cross,optimized,1,0,serial,1,none,simt,f32,128,64,8,2,2,2,1,1,1,1,50,1024,5270528,115655680,21,0.300872,16.3144,384.401
2,1,CUTLASS,conv2d,cutlass_simt_sfprop_optimized_64x128_8x2_nhwc_align1,passed,success,fprop,1,16,16,256,512,3,3,7,7,0,0,2,2,1,1,f32:nhwc,f32:nhwc,f32:nhwc,cross,optimized,1,0,serial,1,none,simt,f32,64,128,8,2,2,2,1,1,1,1,50,1024,5270528,115655680,21,0.287095,17.0974,402.849
3,1,CUTLASS,conv2d,cutlass_simt_sfprop_optimized_64x64_8x2_nhwc_align1,passed,success,fprop,1,16,16,256,512,3,3,7,7,0,0,2,2,1,1,f32:nhwc,f32:nhwc,f32:nhwc,cross,optimized,1,0,serial,1,none,simt,f32,64,64,8,2,2,1,1,1,1,1,50,1024,5270528,115655680,21,0.300045,16.3594,385.461
4,1,CUTLASS,conv2d,cutlass_simt_sfprop_optimized_128x32_8x2_nhwc_align1,passed,success,fprop,1,16,16,256,512,3,3,7,7,0,0,2,2,1,1,f32:nhwc,f32:nhwc,f32:nhwc,cross,optimized,1,0,serial,1,none,simt,f32,128,32,8,2,2,1,1,1,1,1,50,1024,5270528,115655680,21,0.356497,13.7689,324.422
5,1,CUTLASS,conv2d,cutlass_simt_sfprop_optimized_32x128_8x2_nhwc_align1,passed,success,fprop,1,16,16,256,512,3,3,7,7,0,0,2,2,1,1,f32:nhwc,f32:nhwc,f32:nhwc,cross,optimized,1,0,serial,1,none,simt,f32,32,128,8,2,1,2,1,1,1,1,50,1024,5270528,115655680,21,0.342127,14.3472,338.049
0,1,CUTLASS,conv2d,cutlass_simt_sfprop_optimized_128x128_8x2_nhwc_align1,passed,success,fprop,1,9,9,512,512,3,3,7,7,0,0,1,1,1,1,f32:nhwc,f32:nhwc,f32:nhwc,cross,optimized,1,0,serial,1,none,simt,f32,128,128,8,2,4,2,1,1,1,1,50,1024,10440704,231261184,22,1.04492,9.30568,221.32
1,1,CUTLASS,conv2d,cutlass_simt_sfprop_optimized_128x64_8x2_nhwc_align1,passed,success,fprop,1,9,9,512,512,3,3,7,7,0,0,1,1,1,1,f32:nhwc,f32:nhwc,f32:nhwc,cross,optimized,1,0,serial,1,none,simt,f32,128,64,8,2,2,2,1,1,1,1,50,1024,10440704,231261184,22,0.595566,16.3267,388.305
2,1,CUTLASS,conv2d,cutlass_simt_sfprop_optimized_64x128_8x2_nhwc_align1,passed,success,fprop,1,9,9,512,512,3,3,7,7,0,0,1,1,1,1,f32:nhwc,f32:nhwc,f32:nhwc,cross,optimized,1,0,serial,1,none,simt,f32,64,128,8,2,2,2,1,1,1,1,50,1024,10440704,231261184,22,0.568776,17.0958,406.595
3,1,CUTLASS,conv2d,cutlass_simt_sfprop_optimized_64x64_8x2_nhwc_align1,passed,success,fprop,1,9,9,512,512,3,3,7,7,0,0,1,1,1,1,f32:nhwc,f32:nhwc,f32:nhwc,cross,optimized,1,0,serial,1,none,simt,f32,64,64,8,2,2,1,1,1,1,1,50,1024,10440704,231261184,22,0.593434,16.3854,389.7
4,1,CUTLASS,conv2d,cutlass_simt_sfprop_optimized_128x32_8x2_nhwc_align1,passed,success,fprop,1,9,9,512,512,3,3,7,7,0,0,1,1,1,1,f32:nhwc,f32:nhwc,f32:nhwc,cross,optimized,1,0,serial,1,none,simt,f32,128,32,8,2,2,1,1,1,1,1,50,1024,10440704,231261184,22,0.705385,13.7849,327.851
5,1,CUTLASS,conv2d,cutlass_simt_sfprop_optimized_32x128_8x2_nhwc_align1,passed,success,fprop,1,9,9,512,512,3,3,7,7,0,0,1,1,1,1,f32:nhwc,f32:nhwc,f32:nhwc,cross,optimized,1,0,serial,1,none,simt,f32,32,128,8,2,1,2,1,1,1,1,50,1024,10440704,231261184,22,0.673675,14.4338,343.283
0,1,CUTLASS,conv2d,cutlass_simt_sfprop_optimized_128x128_8x2_nhwc_align1,passed,success,fprop,1,58,58,64,64,3,3,56,56,0,0,1,1,1,1,f32:nhwc,f32:nhwc,f32:nhwc,cross,optimized,1,0,serial,1,none,simt,f32,128,128,8,2,4,2,1,1,1,1,50,1024,8175616,231612416,28,0.135254,56.2951,1712.42
1,1,CUTLASS,conv2d,cutlass_simt_sfprop_optimized_128x64_8x2_nhwc_align1,passed,success,fprop,1,58,58,64,64,3,3,56,56,0,0,1,1,1,1,f32:nhwc,f32:nhwc,f32:nhwc,cross,optimized,1,0,serial,1,none,simt,f32,128,64,8,2,2,2,1,1,1,1,50,1024,8175616,231612416,28,0.0811014,93.8841,2855.84
2,1,CUTLASS,conv2d,cutlass_simt_sfprop_optimized_64x128_8x2_nhwc_align1,passed,success,fprop,1,58,58,64,64,3,3,56,56,0,0,1,1,1,1,f32:nhwc,f32:nhwc,f32:nhwc,cross,optimized,1,0,serial,1,none,simt,f32,64,128,8,2,2,2,1,1,1,1,50,1024,8175616,231612416,28,0.0785197,96.9711,2949.74
3,1,CUTLASS,conv2d,cutlass_simt_sfprop_optimized_64x64_8x2_nhwc_align1,passed,success,fprop,1,58,58,64,64,3,3,56,56,0,0,1,1,1,1,f32:nhwc,f32:nhwc,f32:nhwc,cross,optimized,1,0,serial,1,none,simt,f32,64,64,8,2,2,1,1,1,1,1,50,1024,8175616,231612416,28,0.0801357,95.0156,2890.25
4,1,CUTLASS,conv2d,cutlass_simt_sfprop_optimized_128x32_8x2_nhwc_align1,passed,success,fprop,1,58,58,64,64,3,3,56,56,0,0,1,1,1,1,f32:nhwc,f32:nhwc,f32:nhwc,cross,optimized,1,0,serial,1,none,simt,f32,128,32,8,2,2,1,1,1,1,1,50,1024,8175616,231612416,28,0.095256,79.9334,2431.47
5,1,CUTLASS,conv2d,cutlass_simt_sfprop_optimized_32x128_8x2_nhwc_align1,passed,success,fprop,1,58,58,64,64,3,3,56,56,0,0,1,1,1,1,f32:nhwc,f32:nhwc,f32:nhwc,cross,optimized,1,0,serial,1,none,simt,f32,32,128,8,2,1,2,1,1,1,1,50,1024,8175616,231612416,28,0.142549,53.4142,1624.79
0,1,CUTLASS,conv2d,cutlass_simt_sfprop_optimized_128x128_8x2_nhwc_align1,passed,success,fprop,1,58,58,64,128,3,3,28,28,0,0,2,2,1,1,f32:nhwc,f32:nhwc,f32:nhwc,cross,optimized,1,0,serial,1,none,simt,f32,128,128,8,2,4,2,1,1,1,1,50,1024,2502656,115806208,46,0.135374,17.2174,855.455
1,1,CUTLASS,conv2d,cutlass_simt_sfprop_optimized_128x64_8x2_nhwc_align1,passed,success,fprop,1,58,58,64,128,3,3,28,28,0,0,2,2,1,1,f32:nhwc,f32:nhwc,f32:nhwc,cross,optimized,1,0,serial,1,none,simt,f32,128,64,8,2,2,2,1,1,1,1,50,1024,2502656,115806208,46,0.0810922,28.7424,1428.08
2,1,CUTLASS,conv2d,cutlass_simt_sfprop_optimized_64x128_8x2_nhwc_align1,passed,success,fprop,1,58,58,64,128,3,3,28,28,0,0,2,2,1,1,f32:nhwc,f32:nhwc,f32:nhwc,cross,optimized,1,0,serial,1,none,simt,f32,64,128,8,2,2,2,1,1,1,1,50,1024,2502656,115806208,46,0.0768662,30.3225,1506.59
3,1,CUTLASS,conv2d,cutlass_simt_sfprop_optimized_64x64_8x2_nhwc_align1,passed,success,fprop,1,58,58,64,128,3,3,28,28,0,0,2,2,1,1,f32:nhwc,f32:nhwc,f32:nhwc,cross,optimized,1,0,serial,1,none,simt,f32,64,64,8,2,2,1,1,1,1,1,50,1024,2502656,115806208,46,0.0800512,29.1161,1446.65
4,1,CUTLASS,conv2d,cutlass_simt_sfprop_optimized_128x32_8x2_nhwc_align1,passed,success,fprop,1,58,58,64,128,3,3,28,28,0,0,2,2,1,1,f32:nhwc,f32:nhwc,f32:nhwc,cross,optimized,1,0,serial,1,none,simt,f32,128,32,8,2,2,1,1,1,1,1,50,1024,2502656,115806208,46,0.0952992,24.4575,1215.19
5,1,CUTLASS,conv2d,cutlass_simt_sfprop_optimized_32x128_8x2_nhwc_align1,passed,success,fprop,1,58,58,64,128,3,3,28,28,0,0,2,2,1,1,f32:nhwc,f32:nhwc,f32:nhwc,cross,optimized,1,0,serial,1,none,simt,f32,32,128,8,2,1,2,1,1,1,1,50,1024,2502656,115806208,46,0.0890096,26.1857,1301.05
0,1,CUTLASS,conv2d,cutlass_simt_sfprop_optimized_128x128_8x2_nhwc_align1,passed,success,fprop,1,30,30,128,128,3,3,28,28,0,0,1,1,1,1,f32:nhwc,f32:nhwc,f32:nhwc,cross,optimized,1,0,serial,1,none,simt,f32,128,128,8,2,4,2,1,1,1,1,50,1024,4603904,231411712,50,0.263372,16.2801,878.648
1,1,CUTLASS,conv2d,cutlass_simt_sfprop_optimized_128x64_8x2_nhwc_align1,passed,success,fprop,1,30,30,128,128,3,3,28,28,0,0,1,1,1,1,f32:nhwc,f32:nhwc,f32:nhwc,cross,optimized,1,0,serial,1,none,simt,f32,128,64,8,2,2,2,1,1,1,1,50,1024,4603904,231411712,50,0.155772,27.5256,1485.58
2,1,CUTLASS,conv2d,cutlass_simt_sfprop_optimized_64x128_8x2_nhwc_align1,passed,success,fprop,1,30,30,128,128,3,3,28,28,0,0,1,1,1,1,f32:nhwc,f32:nhwc,f32:nhwc,cross,optimized,1,0,serial,1,none,simt,f32,64,128,8,2,2,2,1,1,1,1,50,1024,4603904,231411712,50,0.147062,29.1558,1573.56
3,1,CUTLASS,conv2d,cutlass_simt_sfprop_optimized_64x64_8x2_nhwc_align1,passed,success,fprop,1,30,30,128,128,3,3,28,28,0,0,1,1,1,1,f32:nhwc,f32:nhwc,f32:nhwc,cross,optimized,1,0,serial,1,none,simt,f32,64,64,8,2,2,1,1,1,1,1,50,1024,4603904,231411712,50,0.152874,28.0474,1513.74
4,1,CUTLASS,conv2d,cutlass_simt_sfprop_optimized_128x32_8x2_nhwc_align1,passed,success,fprop,1,30,30,128,128,3,3,28,28,0,0,1,1,1,1,f32:nhwc,f32:nhwc,f32:nhwc,cross,optimized,1,0,serial,1,none,simt,f32,128,32,8,2,2,1,1,1,1,1,50,1024,4603904,231411712,50,0.182598,23.4817,1267.33
5,1,CUTLASS,conv2d,cutlass_simt_sfprop_optimized_32x128_8x2_nhwc_align1,passed,success,fprop,1,30,30,128,128,3,3,28,28,0,0,1,1,1,1,f32:nhwc,f32:nhwc,f32:nhwc,cross,optimized,1,0,serial,1,none,simt,f32,32,128,8,2,1,2,1,1,1,1,50,1024,4603904,231411712,50,0.16811,25.5054,1376.55
0,1,CUTLASS,conv2d,cutlass_simt_sfprop_optimized_128x128_8x2_nhwc_align1,passed,success,fprop,1,30,30,128,256,3,3,14,14,0,0,2,2,1,1,f32:nhwc,f32:nhwc,f32:nhwc,cross,optimized,1,0,serial,1,none,simt,f32,128,128,8,2,4,2,1,1,1,1,50,1024,2283520,115705856,50,0.262276,8.10861,441.161
1,1,CUTLASS,conv2d,cutlass_simt_sfprop_optimized_128x64_8x2_nhwc_align1,passed,success,fprop,1,30,30,128,256,3,3,14,14,0,0,2,2,1,1,f32:nhwc,f32:nhwc,f32:nhwc,cross,optimized,1,0,serial,1,none,simt,f32,128,64,8,2,2,2,1,1,1,1,50,1024,2283520,115705856,50,0.155019,13.7189,746.397
2,1,CUTLASS,conv2d,cutlass_simt_sfprop_optimized_64x128_8x2_nhwc_align1,passed,success,fprop,1,30,30,128,256,3,3,14,14,0,0,2,2,1,1,f32:nhwc,f32:nhwc,f32:nhwc,cross,optimized,1,0,serial,1,none,simt,f32,64,128,8,2,2,2,1,1,1,1,50,1024,2283520,115705856,50,0.146951,14.4721,787.377
3,1,CUTLASS,conv2d,cutlass_simt_sfprop_optimized_64x64_8x2_nhwc_align1,passed,success,fprop,1,30,30,128,256,3,3,14,14,0,0,2,2,1,1,f32:nhwc,f32:nhwc,f32:nhwc,cross,optimized,1,0,serial,1,none,simt,f32,64,64,8,2,2,1,1,1,1,1,50,1024,2283520,115705856,50,0.152946,13.9048,756.513
4,1,CUTLASS,conv2d,cutlass_simt_sfprop_optimized_128x32_8x2_nhwc_align1,passed,success,fprop,1,30,30,128,256,3,3,14,14,0,0,2,2,1,1,f32:nhwc,f32:nhwc,f32:nhwc,cross,optimized,1,0,serial,1,none,simt,f32,128,32,8,2,2,1,1,1,1,1,50,1024,2283520,115705856,50,0.182802,11.6338,632.956
5,1,CUTLASS,conv2d,cutlass_simt_sfprop_optimized_32x128_8x2_nhwc_align1,passed,success,fprop,1,30,30,128,256,3,3,14,14,0,0,2,2,1,1,f32:nhwc,f32:nhwc,f32:nhwc,cross,optimized,1,0,serial,1,none,simt,f32,32,128,8,2,1,2,1,1,1,1,50,1024,2283520,115705856,50,0.170665,12.4612,677.971
0,1,CUTLASS,conv2d,cutlass_simt_sfprop_optimized_128x128_8x2_nhwc_align1,passed,success,fprop,1,16,16,256,256,3,3,14,14,0,0,1,1,1,1,f32:nhwc,f32:nhwc,f32:nhwc,cross,optimized,1,0,serial,1,none,simt,f32,128,128,8,2,4,2,1,1,1,1,50,1024,4366336,231311360,52,0.517509,7.85777,446.971
1,1,CUTLASS,conv2d,cutlass_simt_sfprop_optimized_128x64_8x2_nhwc_align1,passed,success,fprop,1,16,16,256,256,3,3,14,14,0,0,1,1,1,1,f32:nhwc,f32:nhwc,f32:nhwc,cross,optimized,1,0,serial,1,none,simt,f32,128,64,8,2,2,2,1,1,1,1,50,1024,4366336,231311360,52,0.304738,13.3442,759.051
2,1,CUTLASS,conv2d,cutlass_simt_sfprop_optimized_64x128_8x2_nhwc_align1,passed,success,fprop,1,16,16,256,256,3,3,14,14,0,0,1,1,1,1,f32:nhwc,f32:nhwc,f32:nhwc,cross,optimized,1,0,serial,1,none,simt,f32,64,128,8,2,2,2,1,1,1,1,50,1024,4366336,231311360,52,0.287865,14.1263,803.54
3,1,CUTLASS,conv2d,cutlass_simt_sfprop_optimized_64x64_8x2_nhwc_align1,passed,success,fprop,1,16,16,256,256,3,3,14,14,0,0,1,1,1,1,f32:nhwc,f32:nhwc,f32:nhwc,cross,optimized,1,0,serial,1,none,simt,f32,64,64,8,2,2,1,1,1,1,1,50,1024,4366336,231311360,52,0.299286,13.5872,772.876
4,1,CUTLASS,conv2d,cutlass_simt_sfprop_optimized_128x32_8x2_nhwc_align1,passed,success,fprop,1,16,16,256,256,3,3,14,14,0,0,1,1,1,1,f32:nhwc,f32:nhwc,f32:nhwc,cross,optimized,1,0,serial,1,none,simt,f32,128,32,8,2,2,1,1,1,1,1,50,1024,4366336,231311360,52,0.358046,11.3574,646.037
5,1,CUTLASS,conv2d,cutlass_simt_sfprop_optimized_32x128_8x2_nhwc_align1,passed,success,fprop,1,16,16,256,256,3,3,14,14,0,0,1,1,1,1,f32:nhwc,f32:nhwc,f32:nhwc,cross,optimized,1,0,serial,1,none,simt,f32,32,128,8,2,1,2,1,1,1,1,50,1024,4366336,231311360,52,0.331839,12.2543,697.059
0,1,CUTLASS,conv2d,cutlass_simt_sfprop_optimized_128x128_8x2_nhwc_align1,passed,success,fprop,1,546,546,3,32,3,3,544,544,0,0,1,1,1,1,f32:nhwc,f32:nhwc,f32:nhwc,cross,optimized,1,0,serial,1,none,simt,f32,128,128,8,2,4,2,1,1,1,1,50,1024,69844352,530317312,7,0.74489,87.3251,711.94
1,1,CUTLASS,conv2d,cutlass_simt_sfprop_optimized_128x64_8x2_nhwc_align1,passed,success,fprop,1,546,546,3,32,3,3,544,544,0,0,1,1,1,1,f32:nhwc,f32:nhwc,f32:nhwc,cross,optimized,1,0,serial,1,none,simt,f32,128,64,8,2,2,2,1,1,1,1,50,1024,69844352,530317312,7,0.351646,184.981,1508.1
2,1,CUTLASS,conv2d,cutlass_simt_sfprop_optimized_64x128_8x2_nhwc_align1,passed,success,fprop,1,546,546,3,32,3,3,544,544,0,0,1,1,1,1,f32:nhwc,f32:nhwc,f32:nhwc,cross,optimized,1,0,serial,1,none,simt,f32,64,128,8,2,2,2,1,1,1,1,50,1024,69844352,530317312,7,0.644922,100.861,822.297
3,1,CUTLASS,conv2d,cutlass_simt_sfprop_optimized_64x64_8x2_nhwc_align1,passed,success,fprop,1,546,546,3,32,3,3,544,544,0,0,1,1,1,1,f32:nhwc,f32:nhwc,f32:nhwc,cross,optimized,1,0,serial,1,none,simt,f32,64,64,8,2,2,1,1,1,1,1,50,1024,69844352,530317312,7,0.362666,179.36,1462.28
4,1,CUTLASS,conv2d,cutlass_simt_sfprop_optimized_128x32_8x2_nhwc_align1,passed,success,fprop,1,546,546,3,32,3,3,544,544,0,0,1,1,1,1,f32:nhwc,f32:nhwc,f32:nhwc,cross,optimized,1,0,serial,1,none,simt,f32,128,32,8,2,2,1,1,1,1,1,50,1024,69844352,530317312,7,0.23039,282.337,2301.83
5,1,CUTLASS,conv2d,cutlass_simt_sfprop_optimized_32x128_8x2_nhwc_align1,passed,success,fprop,1,546,546,3,32,3,3,544,544,0,0,1,1,1,1,f32:nhwc,f32:nhwc,f32:nhwc,cross,optimized,1,0,serial,1,none,simt,f32,32,128,8,2,1,2,1,1,1,1,50,1024,69844352,530317312,7,0.70809,91.8635,748.94
0,1,CUTLASS,conv2d,cutlass_simt_sfprop_optimized_128x128_8x2_nhwc_align1,passed,success,fprop,1,274,274,32,64,3,3,272,272,0,0,1,1,1,1,f32:nhwc,f32:nhwc,f32:nhwc,cross,optimized,1,0,serial,1,none,simt,f32,128,128,8,2,4,2,1,1,1,1,50,1024,104243200,2736816128,26,0.649274,149.527,4215.19
1,1,CUTLASS,conv2d,cutlass_simt_sfprop_optimized_128x64_8x2_nhwc_align1,passed,success,fprop,1,274,274,32,64,3,3,272,272,0,0,1,1,1,1,f32:nhwc,f32:nhwc,f32:nhwc,cross,optimized,1,0,serial,1,none,simt,f32,128,64,8,2,2,2,1,1,1,1,50,1024,104243200,2736816128,26,0.326226,297.597,8389.32
2,1,CUTLASS,conv2d,cutlass_simt_sfprop_optimized_64x128_8x2_nhwc_align1,passed,success,fprop,1,274,274,32,64,3,3,272,272,0,0,1,1,1,1,f32:nhwc,f32:nhwc,f32:nhwc,cross,optimized,1,0,serial,1,none,simt,f32,64,128,8,2,2,2,1,1,1,1,50,1024,104243200,2736816128,26,0.588038,165.098,4654.15
3,1,CUTLASS,conv2d,cutlass_simt_sfprop_optimized_64x64_8x2_nhwc_align1,passed,success,fprop,1,274,274,32,64,3,3,272,272,0,0,1,1,1,1,f32:nhwc,f32:nhwc,f32:nhwc,cross,optimized,1,0,serial,1,none,simt,f32,64,64,8,2,2,1,1,1,1,1,50,1024,104243200,2736816128,26,0.350347,277.108,7811.73
4,1,CUTLASS,conv2d,cutlass_simt_sfprop_optimized_128x32_8x2_nhwc_align1,passed,success,fprop,1,274,274,32,64,3,3,272,272,0,0,1,1,1,1,f32:nhwc,f32:nhwc,f32:nhwc,cross,optimized,1,0,serial,1,none,simt,f32,128,32,8,2,2,1,1,1,1,1,50,1024,104243200,2736816128,26,0.402078,241.456,6806.67
5,1,CUTLASS,conv2d,cutlass_simt_sfprop_optimized_32x128_8x2_nhwc_align1,passed,success,fprop,1,274,274,32,64,3,3,272,272,0,0,1,1,1,1,f32:nhwc,f32:nhwc,f32:nhwc,cross,optimized,1,0,serial,1,none,simt,f32,32,128,8,2,1,2,1,1,1,1,50,1024,104243200,2736816128,26,0.651296,149.063,4202.11
0,1,CUTLASS,conv2d,cutlass_simt_sfprop_optimized_128x128_8x2_nhwc_align1,passed,success,fprop,1,138,138,64,128,3,3,136,136,0,0,1,1,1,1,f32:nhwc,f32:nhwc,f32:nhwc,cross,optimized,1,0,serial,1,none,simt,f32,128,128,8,2,4,2,1,1,1,1,50,1024,52379648,2732081152,52,0.410785,118.754,6650.88
1,1,CUTLASS,conv2d,cutlass_simt_sfprop_optimized_128x64_8x2_nhwc_align1,passed,success,fprop,1,138,138,64,128,3,3,136,136,0,0,1,1,1,1,f32:nhwc,f32:nhwc,f32:nhwc,cross,optimized,1,0,serial,1,none,simt,f32,128,64,8,2,2,2,1,1,1,1,50,1024,52379648,2732081152,52,0.352994,138.196,7739.73
2,1,CUTLASS,conv2d,cutlass_simt_sfprop_optimized_64x128_8x2_nhwc_align1,passed,success,fprop,1,138,138,64,128,3,3,136,136,0,0,1,1,1,1,f32:nhwc,f32:nhwc,f32:nhwc,cross,optimized,1,0,serial,1,none,simt,f32,64,128,8,2,2,2,1,1,1,1,50,1024,52379648,2732081152,52,0.334249,145.946,8173.78
3,1,CUTLASS,conv2d,cutlass_simt_sfprop_optimized_64x64_8x2_nhwc_align1,passed,success,fprop,1,138,138,64,128,3,3,136,136,0,0,1,1,1,1,f32:nhwc,f32:nhwc,f32:nhwc,cross,optimized,1,0,serial,1,none,simt,f32,64,64,8,2,2,1,1,1,1,1,50,1024,52379648,2732081152,52,0.367589,132.709,7432.43
4,1,CUTLASS,conv2d,cutlass_simt_sfprop_optimized_128x32_8x2_nhwc_align1,passed,success,fprop,1,138,138,64,128,3,3,136,136,0,0,1,1,1,1,f32:nhwc,f32:nhwc,f32:nhwc,cross,optimized,1,0,serial,1,none,simt,f32,128,32,8,2,2,1,1,1,1,1,50,1024,52379648,2732081152,52,0.420013,116.145,6504.76
5,1,CUTLASS,conv2d,cutlass_simt_sfprop_optimized_32x128_8x2_nhwc_align1,passed,success,fprop,1,138,138,64,128,3,3,136,136,0,0,1,1,1,1,f32:nhwc,f32:nhwc,f32:nhwc,cross,optimized,1,0,serial,1,none,simt,f32,32,128,8,2,1,2,1,1,1,1,50,1024,52379648,2732081152,52,0.389362,125.288,7016.82
0,1,CUTLASS,conv2d,cutlass_simt_sfprop_optimized_128x128_8x2_nhwc_align1,passed,success,fprop,1,70,70,128,256,3,3,68,68,0,0,1,1,1,1,f32:nhwc,f32:nhwc,f32:nhwc,cross,optimized,1,0,serial,1,none,simt,f32,128,128,8,2,4,2,1,1,1,1,50,1024,27222016,2729713664,100,0.53203,47.6523,5130.75
1,1,CUTLASS,conv2d,cutlass_simt_sfprop_optimized_128x64_8x2_nhwc_align1,passed,success,fprop,1,70,70,128,256,3,3,68,68,0,0,1,1,1,1,f32:nhwc,f32:nhwc,f32:nhwc,cross,optimized,1,0,serial,1,none,simt,f32,128,64,8,2,2,2,1,1,1,1,50,1024,27222016,2729713664,100,0.417502,60.7242,6538.2
2,1,CUTLASS,conv2d,cutlass_simt_sfprop_optimized_64x128_8x2_nhwc_align1,passed,success,fprop,1,70,70,128,256,3,3,68,68,0,0,1,1,1,1,f32:nhwc,f32:nhwc,f32:nhwc,cross,optimized,1,0,serial,1,none,simt,f32,64,128,8,2,2,2,1,1,1,1,50,1024,27222016,2729713664,100,0.398022,63.6962,6858.2
3,1,CUTLASS,conv2d,cutlass_simt_sfprop_optimized_64x64_8x2_nhwc_align1,passed,success,fprop,1,70,70,128,256,3,3,68,68,0,0,1,1,1,1,f32:nhwc,f32:nhwc,f32:nhwc,cross,optimized,1,0,serial,1,none,simt,f32,64,64,8,2,2,1,1,1,1,1,50,1024,27222016,2729713664,100,0.423788,59.8235,6441.22
4,1,CUTLASS,conv2d,cutlass_simt_sfprop_optimized_128x32_8x2_nhwc_align1,passed,success,fprop,1,70,70,128,256,3,3,68,68,0,0,1,1,1,1,f32:nhwc,f32:nhwc,f32:nhwc,cross,optimized,1,0,serial,1,none,simt,f32,128,32,8,2,2,1,1,1,1,1,50,1024,27222016,2729713664,100,0.493841,51.3373,5527.52
5,1,CUTLASS,conv2d,cutlass_simt_sfprop_optimized_32x128_8x2_nhwc_align1,passed,success,fprop,1,70,70,128,256,3,3,68,68,0,0,1,1,1,1,f32:nhwc,f32:nhwc,f32:nhwc,cross,optimized,1,0,serial,1,none,simt,f32,32,128,8,2,1,2,1,1,1,1,50,1024,27222016,2729713664,100,0.45166,56.1317,6043.73
0,1,CUTLASS,conv2d,cutlass_simt_sfprop_optimized_128x128_8x2_nhwc_align1,passed,success,fprop,1,36,36,256,512,3,3,34,34,0,0,1,1,1,1,f32:nhwc,f32:nhwc,f32:nhwc,cross,optimized,1,0,serial,1,none,simt,f32,128,128,8,2,4,2,1,1,1,1,50,1024,17739776,2728529920,153,0.544856,30.3226,5007.8
1,1,CUTLASS,conv2d,cutlass_simt_sfprop_optimized_128x64_8x2_nhwc_align1,passed,success,fprop,1,36,36,256,512,3,3,34,34,0,0,1,1,1,1,f32:nhwc,f32:nhwc,f32:nhwc,cross,optimized,1,0,serial,1,none,simt,f32,128,64,8,2,2,2,1,1,1,1,50,1024,17739776,2728529920,153,0.550298,30.0228,4958.28
2,1,CUTLASS,conv2d,cutlass_simt_sfprop_optimized_64x128_8x2_nhwc_align1,passed,success,fprop,1,36,36,256,512,3,3,34,34,0,0,1,1,1,1,f32:nhwc,f32:nhwc,f32:nhwc,cross,optimized,1,0,serial,1,none,simt,f32,64,128,8,2,2,2,1,1,1,1,50,1024,17739776,2728529920,153,0.531396,31.0907,5134.65
3,1,CUTLASS,conv2d,cutlass_simt_sfprop_optimized_64x64_8x2_nhwc_align1,passed,success,fprop,1,36,36,256,512,3,3,34,34,0,0,1,1,1,1,f32:nhwc,f32:nhwc,f32:nhwc,cross,optimized,1,0,serial,1,none,simt,f32,64,64,8,2,2,1,1,1,1,1,50,1024,17739776,2728529920,153,0.557496,29.6351,4894.26
4,1,CUTLASS,conv2d,cutlass_simt_sfprop_optimized_128x32_8x2_nhwc_align1,passed,success,fprop,1,36,36,256,512,3,3,34,34,0,0,1,1,1,1,f32:nhwc,f32:nhwc,f32:nhwc,cross,optimized,1,0,serial,1,none,simt,f32,128,32,8,2,2,1,1,1,1,1,50,1024,17739776,2728529920,153,0.64285,25.7003,4244.43
5,1,CUTLASS,conv2d,cutlass_simt_sfprop_optimized_32x128_8x2_nhwc_align1,passed,success,fprop,1,36,36,256,512,3,3,34,34,0,0,1,1,1,1,f32:nhwc,f32:nhwc,f32:nhwc,cross,optimized,1,0,serial,1,none,simt,f32,32,128,8,2,1,2,1,1,1,1,50,1024,17739776,2728529920,153,0.576907,28.638,4729.59
0,1,CUTLASS,conv2d,cutlass_simt_sfprop_optimized_128x128_8x2_nhwc_align1,passed,success,fprop,1,19,19,512,1024,3,3,17,17,0,0,1,1,1,1,f32:nhwc,f32:nhwc,f32:nhwc,cross,optimized,1,0,serial,1,none,simt,f32,128,128,8,2,4,2,1,1,1,1,50,1024,25384960,2727938048,107,1.03532,22.8351,2634.87
1,1,CUTLASS,conv2d,cutlass_simt_sfprop_optimized_128x64_8x2_nhwc_align1,passed,success,fprop,1,19,19,512,1024,3,3,17,17,0,0,1,1,1,1,f32:nhwc,f32:nhwc,f32:nhwc,cross,optimized,1,0,serial,1,none,simt,f32,128,64,8,2,2,2,1,1,1,1,50,1024,25384960,2727938048,107,0.622158,37.9993,4384.64
2,1,CUTLASS,conv2d,cutlass_simt_sfprop_optimized_64x128_8x2_nhwc_align1,passed,success,fprop,1,19,19,512,1024,3,3,17,17,0,0,1,1,1,1,f32:nhwc,f32:nhwc,f32:nhwc,cross,optimized,1,0,serial,1,none,simt,f32,64,128,8,2,2,2,1,1,1,1,50,1024,25384960,2727938048,107,0.584802,40.4266,4664.72
3,1,CUTLASS,conv2d,cutlass_simt_sfprop_optimized_64x64_8x2_nhwc_align1,passed,success,fprop,1,19,19,512,1024,3,3,17,17,0,0,1,1,1,1,f32:nhwc,f32:nhwc,f32:nhwc,cross,optimized,1,0,serial,1,none,simt,f32,64,64,8,2,2,1,1,1,1,1,50,1024,25384960,2727938048,107,1.06905,22.1147,2551.75
4,1,CUTLASS,conv2d,cutlass_simt_sfprop_optimized_128x32_8x2_nhwc_align1,passed,success,fprop,1,19,19,512,1024,3,3,17,17,0,0,1,1,1,1,f32:nhwc,f32:nhwc,f32:nhwc,cross,optimized,1,0,serial,1,none,simt,f32,128,32,8,2,2,1,1,1,1,1,50,1024,25384960,2727938048,107,1.22013,19.3762,2235.77
5,1,CUTLASS,conv2d,cutlass_simt_sfprop_optimized_32x128_8x2_nhwc_align1,passed,success,fprop,1,19,19,512,1024,3,3,17,17,0,0,1,1,1,1,f32:nhwc,f32:nhwc,f32:nhwc,cross,optimized,1,0,serial,1,none,simt,f32,32,128,8,2,1,2,1,1,1,1,50,1024,25384960,2727938048,107,1.11056,21.2881,2456.37
