cutlass/conv2d-v100.csv
,Problem,Provider,OperationKind,Operation,Disposition,Status,conv_kind,n,h,w,c,k,r,s,p,q,pad_h,pad_w,stride_h,stride_w,dilation_h,dilation_w,Activation,Filter,Output,conv_mode,iterator_algorithm,alpha,beta,split_k_mode,split_k_slices,eq_gemm_provider,op_class,accum,cta_m,cta_n,cta_k,stages,warps_m,warps_n,warps_k,inst_m,inst_n,inst_k,min_cc,max_cc,Bytes,Flops,Flops/Byte,Runtime,GB/s,GFLOPs
0,1,CUTLASS,conv2d,cutlass_simt_sfprop_optimized_128x128_8x2_nhwc_align1,passed,success,fprop,1,110,110,3,32,3,3,108,108,0,0,1,1,1,1,f32:nhwc,f32:nhwc,f32:nhwc,cross,optimized,1,0,serial,1,none,simt,f32,128,128,8,2,4,2,1,1,1,1,50,1024,2756160,20901888,7,0.0457626,56.0911,456.746
1,1,CUTLASS,conv2d,cutlass_simt_sfprop_optimized_128x64_8x2_nhwc_align1,passed,success,fprop,1,110,110,3,32,3,3,108,108,0,0,1,1,1,1,f32:nhwc,f32:nhwc,f32:nhwc,cross,optimized,1,0,serial,1,none,simt,f32,128,64,8,2,2,2,1,1,1,1,50,1024,2756160,20901888,7,0.028232,90.9207,740.362
2,1,CUTLASS,conv2d,cutlass_simt_sfprop_optimized_64x128_8x2_nhwc_align1,passed,success,fprop,1,110,110,3,32,3,3,108,108,0,0,1,1,1,1,f32:nhwc,f32:nhwc,f32:nhwc,cross,optimized,1,0,serial,1,none,simt,f32,64,128,8,2,2,2,1,1,1,1,50,1024,2756160,20901888,7,0.035615,72.0728,586.884
3,1,CUTLASS,conv2d,cutlass_simt_sfprop_optimized_64x64_8x2_nhwc_align1,passed,success,fprop,1,110,110,3,32,3,3,108,108,0,0,1,1,1,1,f32:nhwc,f32:nhwc,f32:nhwc,cross,optimized,1,0,serial,1,none,simt,f32,64,64,8,2,2,1,1,1,1,1,50,1024,2756160,20901888,7,0.0291632,88.0176,716.721
4,1,CUTLASS,conv2d,cutlass_simt_sfprop_optimized_128x32_8x2_nhwc_align1,passed,success,fprop,1,110,110,3,32,3,3,108,108,0,0,1,1,1,1,f32:nhwc,f32:nhwc,f32:nhwc,cross,optimized,1,0,serial,1,none,simt,f32,128,32,8,2,2,1,1,1,1,1,50,1024,2756160,20901888,7,0.0310272,82.7298,673.663
5,1,CUTLASS,conv2d,cutlass_simt_sfprop_optimized_32x128_8x2_nhwc_align1,passed,success,fprop,1,110,110,3,32,3,3,108,108,0,0,1,1,1,1,f32:nhwc,f32:nhwc,f32:nhwc,cross,optimized,1,0,serial,1,none,simt,f32,32,128,8,2,1,2,1,1,1,1,50,1024,2756160,20901888,7,0.0380826,67.4029,548.857
0,1,CUTLASS,conv2d,cutlass_simt_sfprop_optimized_128x128_8x2_nhwc_align1,passed,success,fprop,1,110,110,32,32,3,3,108,108,0,0,1,1,1,1,f32:nhwc,f32:nhwc,f32:nhwc,cross,optimized,1,0,serial,1,none,simt,f32,128,128,8,2,4,2,1,1,1,1,50,1024,14966784,215737344,14,0.145838,95.5779,1479.29
1,1,CUTLASS,conv2d,cutlass_simt_sfprop_optimized_128x64_8x2_nhwc_align1,passed,success,fprop,1,110,110,32,32,3,3,108,108,0,0,1,1,1,1,f32:nhwc,f32:nhwc,f32:nhwc,cross,optimized,1,0,serial,1,none,simt,f32,128,64,8,2,2,2,1,1,1,1,50,1024,14966784,215737344,14,0.0818483,170.302,2635.82
2,1,CUTLASS,conv2d,cutlass_simt_sfprop_optimized_64x128_8x2_nhwc_align1,passed,success,fprop,1,110,110,32,32,3,3,108,108,0,0,1,1,1,1,f32:nhwc,f32:nhwc,f32:nhwc,cross,optimized,1,0,serial,1,none,simt,f32,64,128,8,2,2,2,1,1,1,1,50,1024,14966784,215737344,14,0.112783,123.59,1912.85
3,1,CUTLASS,conv2d,cutlass_simt_sfprop_optimized_64x64_8x2_nhwc_align1,passed,success,fprop,1,110,110,32,32,3,3,108,108,0,0,1,1,1,1,f32:nhwc,f32:nhwc,f32:nhwc,cross,optimized,1,0,serial,1,none,simt,f32,64,64,8,2,2,1,1,1,1,1,50,1024,14966784,215737344,14,0.0858931,162.282,2511.7
4,1,CUTLASS,conv2d,cutlass_simt_sfprop_optimized_128x32_8x2_nhwc_align1,passed,success,fprop,1,110,110,32,32,3,3,108,108,0,0,1,1,1,1,f32:nhwc,f32:nhwc,f32:nhwc,cross,optimized,1,0,serial,1,none,simt,f32,128,32,8,2,2,1,1,1,1,1,50,1024,14966784,215737344,14,0.0886067,157.312,2434.77
5,1,CUTLASS,conv2d,cutlass_simt_sfprop_optimized_32x128_8x2_nhwc_align1,passed,success,fprop,1,110,110,32,32,3,3,108,108,0,0,1,1,1,1,f32:nhwc,f32:nhwc,f32:nhwc,cross,optimized,1,0,serial,1,none,simt,f32,32,128,8,2,1,2,1,1,1,1,50,1024,14966784,215737344,14,0.120248,115.918,1794.1
0,1,CUTLASS,conv2d,cutlass_simt_sfprop_optimized_128x128_8x2_nhwc_align1,passed,success,fprop,1,56,56,32,64,3,3,54,54,0,0,1,1,1,1,f32:nhwc,f32:nhwc,f32:nhwc,cross,optimized,1,0,serial,1,none,simt,f32,128,128,8,2,4,2,1,1,1,1,50,1024,4179456,107868672,25,0.0742298,52.4375,1453.17
1,1,CUTLASS,conv2d,cutlass_simt_sfprop_optimized_128x64_8x2_nhwc_align1,passed,success,fprop,1,56,56,32,64,3,3,54,54,0,0,1,1,1,1,f32:nhwc,f32:nhwc,f32:nhwc,cross,optimized,1,0,serial,1,none,simt,f32,128,64,8,2,2,2,1,1,1,1,50,1024,4179456,107868672,25,0.0475341,81.887,2269.29
2,1,CUTLASS,conv2d,cutlass_simt_sfprop_optimized_64x128_8x2_nhwc_align1,passed,success,fprop,1,56,56,32,64,3,3,54,54,0,0,1,1,1,1,f32:nhwc,f32:nhwc,f32:nhwc,cross,optimized,1,0,serial,1,none,simt,f32,64,128,8,2,2,2,1,1,1,1,50,1024,4179456,107868672,25,0.0446771,87.1234,2414.41
3,1,CUTLASS,conv2d,cutlass_simt_sfprop_optimized_64x64_8x2_nhwc_align1,passed,success,fprop,1,56,56,32,64,3,3,54,54,0,0,1,1,1,1,f32:nhwc,f32:nhwc,f32:nhwc,cross,optimized,1,0,serial,1,none,simt,f32,64,64,8,2,2,1,1,1,1,1,50,1024,4179456,107868672,25,0.046039,84.5461,2342.98
4,1,CUTLASS,conv2d,cutlass_simt_sfprop_optimized_128x32_8x2_nhwc_align1,passed,success,fprop,1,56,56,32,64,3,3,54,54,0,0,1,1,1,1,f32:nhwc,f32:nhwc,f32:nhwc,cross,optimized,1,0,serial,1,none,simt,f32,128,32,8,2,2,1,1,1,1,1,50,1024,4179456,107868672,25,0.0570883,68.1825,1889.51
5,1,CUTLASS,conv2d,cutlass_simt_sfprop_optimized_32x128_8x2_nhwc_align1,passed,success,fprop,1,56,56,32,64,3,3,54,54,0,0,1,1,1,1,f32:nhwc,f32:nhwc,f32:nhwc,cross,optimized,1,0,serial,1,none,simt,f32,32,128,8,2,1,2,1,1,1,1,50,1024,4179456,107868672,25,0.0812541,47.9043,1327.55
0,1,CUTLASS,conv2d,cutlass_simt_sfprop_optimized_128x128_8x2_nhwc_align1,passed,success,fprop,1,56,56,64,64,3,3,54,54,0,0,1,1,1,1,f32:nhwc,f32:nhwc,f32:nhwc,cross,optimized,1,0,serial,1,none,simt,f32,128,128,8,2,4,2,1,1,1,1,50,1024,7612416,215364096,28,0.140954,50.2975,1527.91
1,1,CUTLASS,conv2d,cutlass_simt_sfprop_optimized_128x64_8x2_nhwc_align1,passed,success,fprop,1,56,56,64,64,3,3,54,54,0,0,1,1,1,1,f32:nhwc,f32:nhwc,f32:nhwc,cross,optimized,1,0,serial,1,none,simt,f32,128,64,8,2,2,2,1,1,1,1,50,1024,7612416,215364096,28,0.0865386,81.9243,2488.65
2,1,CUTLASS,conv2d,cutlass_simt_sfprop_optimized_64x128_8x2_nhwc_align1,passed,success,fprop,1,56,56,64,64,3,3,54,54,0,0,1,1,1,1,f32:nhwc,f32:nhwc,f32:nhwc,cross,optimized,1,0,serial,1,none,simt,f32,64,128,8,2,2,2,1,1,1,1,50,1024,7612416,215364096,28,0.0816845,86.7927,2636.54
3,1,CUTLASS,conv2d,cutlass_simt_sfprop_optimized_64x64_8x2_nhwc_align1,passed,success,fprop,1,56,56,64,64,3,3,54,54,0,0,1,1,1,1,f32:nhwc,f32:nhwc,f32:nhwc,cross,optimized,1,0,serial,1,none,simt,f32,64,64,8,2,2,1,1,1,1,1,50,1024,7612416,215364096,28,0.0835174,84.8878,2578.67
4,1,CUTLASS,conv2d,cutlass_simt_sfprop_optimized_128x32_8x2_nhwc_align1,passed,success,fprop,1,56,56,64,64,3,3,54,54,0,0,1,1,1,1,f32:nhwc,f32:nhwc,f32:nhwc,cross,optimized,1,0,serial,1,none,simt,f32,128,32,8,2,2,1,1,1,1,1,50,1024,7612416,215364096,28,0.103864,68.2584,2073.51
5,1,CUTLASS,conv2d,cutlass_simt_sfprop_optimized_32x128_8x2_nhwc_align1,passed,success,fprop,1,56,56,64,64,3,3,54,54,0,0,1,1,1,1,f32:nhwc,f32:nhwc,f32:nhwc,cross,optimized,1,0,serial,1,none,simt,f32,32,128,8,2,1,2,1,1,1,1,50,1024,7612416,215364096,28,0.148449,47.7579,1450.76
0,1,CUTLASS,conv2d,cutlass_simt_sfprop_optimized_128x128_8x2_nhwc_align1,passed,success,fprop,1,29,29,64,128,3,3,27,27,0,0,1,1,1,1,f32:nhwc,f32:nhwc,f32:nhwc,cross,optimized,1,0,serial,1,none,simt,f32,128,128,8,2,4,2,1,1,1,1,50,1024,2347776,107682048,45,0.141169,15.4888,762.788
1,1,CUTLASS,conv2d,cutlass_simt_sfprop_optimized_128x64_8x2_nhwc_align1,passed,success,fprop,1,29,29,64,128,3,3,27,27,0,0,1,1,1,1,f32:nhwc,f32:nhwc,f32:nhwc,cross,optimized,1,0,serial,1,none,simt,f32,128,64,8,2,2,2,1,1,1,1,50,1024,2347776,107682048,45,0.0865997,25.2488,1243.45
2,1,CUTLASS,conv2d,cutlass_simt_sfprop_optimized_64x128_8x2_nhwc_align1,passed,success,fprop,1,29,29,64,128,3,3,27,27,0,0,1,1,1,1,f32:nhwc,f32:nhwc,f32:nhwc,cross,optimized,1,0,serial,1,none,simt,f32,64,128,8,2,2,2,1,1,1,1,50,1024,2347776,107682048,45,0.0816845,26.7681,1318.27
3,1,CUTLASS,conv2d,cutlass_simt_sfprop_optimized_64x64_8x2_nhwc_align1,passed,success,fprop,1,29,29,64,128,3,3,27,27,0,0,1,1,1,1,f32:nhwc,f32:nhwc,f32:nhwc,cross,optimized,1,0,serial,1,none,simt,f32,64,64,8,2,2,1,1,1,1,1,50,1024,2347776,107682048,45,0.0834358,26.2062,1290.6
4,1,CUTLASS,conv2d,cutlass_simt_sfprop_optimized_128x32_8x2_nhwc_align1,passed,success,fprop,1,29,29,64,128,3,3,27,27,0,0,1,1,1,1,f32:nhwc,f32:nhwc,f32:nhwc,cross,optimized,1,0,serial,1,none,simt,f32,128,32,8,2,2,1,1,1,1,1,50,1024,2347776,107682048,45,0.104694,20.885,1028.54
5,1,CUTLASS,conv2d,cutlass_simt_sfprop_optimized_32x128_8x2_nhwc_align1,passed,success,fprop,1,29,29,64,128,3,3,27,27,0,0,1,1,1,1,f32:nhwc,f32:nhwc,f32:nhwc,cross,optimized,1,0,serial,1,none,simt,f32,32,128,8,2,1,2,1,1,1,1,50,1024,2347776,107682048,45,0.088576,24.6854,1215.7
0,1,CUTLASS,conv2d,cutlass_simt_sfprop_optimized_128x128_8x2_nhwc_align1,passed,success,fprop,1,29,29,128,128,3,3,27,27,0,0,1,1,1,1,f32:nhwc,f32:nhwc,f32:nhwc,cross,optimized,1,0,serial,1,none,simt,f32,128,128,8,2,4,2,1,1,1,1,50,1024,4322304,215177472,49,0.274412,14.6694,784.142
1,1,CUTLASS,conv2d,cutlass_simt_sfprop_optimized_128x64_8x2_nhwc_align1,passed,success,fprop,1,29,29,128,128,3,3,27,27,0,0,1,1,1,1,f32:nhwc,f32:nhwc,f32:nhwc,cross,optimized,1,0,serial,1,none,simt,f32,128,64,8,2,2,2,1,1,1,1,50,1024,4322304,215177472,49,0.164567,24.4609,1307.54
2,1,CUTLASS,conv2d,cutlass_simt_sfprop_optimized_64x128_8x2_nhwc_align1,passed,success,fprop,1,29,29,128,128,3,3,27,27,0,0,1,1,1,1,f32:nhwc,f32:nhwc,f32:nhwc,cross,optimized,1,0,serial,1,none,simt,f32,64,128,8,2,2,2,1,1,1,1,50,1024,4322304,215177472,49,0.155566,25.8762,1383.19
3,1,CUTLASS,conv2d,cutlass_simt_sfprop_optimized_64x64_8x2_nhwc_align1,passed,success,fprop,1,29,29,128,128,3,3,27,27,0,0,1,1,1,1,f32:nhwc,f32:nhwc,f32:nhwc,cross,optimized,1,0,serial,1,none,simt,f32,64,64,8,2,2,1,1,1,1,1,50,1024,4322304,215177472,49,0.158372,25.4178,1358.69
4,1,CUTLASS,conv2d,cutlass_simt_sfprop_optimized_128x32_8x2_nhwc_align1,passed,success,fprop,1,29,29,128,128,3,3,27,27,0,0,1,1,1,1,f32:nhwc,f32:nhwc,f32:nhwc,cross,optimized,1,0,serial,1,none,simt,f32,128,32,8,2,2,1,1,1,1,1,50,1024,4322304,215177472,49,0.19924,20.2041,1079.99
5,1,CUTLASS,conv2d,cutlass_simt_sfprop_optimized_32x128_8x2_nhwc_align1,passed,success,fprop,1,29,29,128,128,3,3,27,27,0,0,1,1,1,1,f32:nhwc,f32:nhwc,f32:nhwc,cross,optimized,1,0,serial,1,none,simt,f32,32,128,8,2,1,2,1,1,1,1,50,1024,4322304,215177472,49,0.169472,23.7529,1269.69
0,1,CUTLASS,conv2d,cutlass_simt_sfprop_optimized_128x128_8x2_nhwc_align1,passed,success,fprop,1,230,230,3,64,7,7,112,112,0,0,2,2,1,1,f32:nhwc,f32:nhwc,f32:nhwc,cross,optimized,1,0,serial,1,none,simt,f32,128,128,8,2,4,2,1,1,1,1,50,1024,10624768,237633536,22,0.195902,50.5105,1213.02
1,1,CUTLASS,conv2d,cutlass_simt_sfprop_optimized_128x64_8x2_nhwc_align1,passed,success,fprop,1,230,230,3,64,7,7,112,112,0,0,2,2,1,1,f32:nhwc,f32:nhwc,f32:nhwc,cross,optimized,1,0,serial,1,none,simt,f32,128,64,8,2,2,2,1,1,1,1,50,1024,10624768,237633536,22,0.107121,92.3733,2218.37
2,1,CUTLASS,conv2d,cutlass_simt_sfprop_optimized_64x128_8x2_nhwc_align1,passed,success,fprop,1,230,230,3,64,7,7,112,112,0,0,2,2,1,1,f32:nhwc,f32:nhwc,f32:nhwc,cross,optimized,1,0,serial,1,none,simt,f32,64,128,8,2,2,2,1,1,1,1,50,1024,10624768,237633536,22,0.153057,64.6496,1552.58
3,1,CUTLASS,conv2d,cutlass_simt_sfprop_optimized_64x64_8x2_nhwc_align1,passed,success,fprop,1,230,230,3,64,7,7,112,112,0,0,2,2,1,1,f32:nhwc,f32:nhwc,f32:nhwc,cross,optimized,1,0,serial,1,none,simt,f32,64,64,8,2,2,1,1,1,1,1,50,1024,10624768,237633536,22,0.112691,87.8071,2108.71
4,1,CUTLASS,conv2d,cutlass_simt_sfprop_optimized_128x32_8x2_nhwc_align1,passed,success,fprop,1,230,230,3,64,7,7,112,112,0,0,2,2,1,1,f32:nhwc,f32:nhwc,f32:nhwc,cross,optimized,1,0,serial,1,none,simt,f32,128,32,8,2,2,1,1,1,1,1,50,1024,10624768,237633536,22,0.129618,76.3404,1833.34
5,1,CUTLASS,conv2d,cutlass_simt_sfprop_optimized_32x128_8x2_nhwc_align1,passed,success,fprop,1,230,230,3,64,7,7,112,112,0,0,2,2,1,1,f32:nhwc,f32:nhwc,f32:nhwc,cross,optimized,1,0,serial,1,none,simt,f32,32,128,8,2,1,2,1,1,1,1,50,1024,10624768,237633536,22,0.164915,60.0011,1440.94
0,1,CUTLASS,conv2d,cutlass_simt_sfprop_optimized_128x128_8x2_nhwc_align1,passed,success,fprop,1,16,16,256,512,3,3,7,7,0,0,2,2,1,1,f32:nhwc,f32:nhwc,f32:nhwc,cross,optimized,1,0,serial,1,none,simt,f32,128,128,8,2,4,2,1,1,1,1,50,1024,5270528,115655680,21,0.539863,9.09223,214.232
1,1,CUTLASS,conv2d,cutlass_simt_sfprop_optimized_128x64_8x2_nhwc_align1,passed,success,fprop,1,16,16,256,512,3,3,7,7,0,0,2,2,1,1,f32:nhwc,f32:nhwc,f32:nhwc,cross,optimized,1,0,serial,1,none,simt,f32,128,64,8,2,2,2,1,1,1,1,50,1024,5270528,115655680,21,0.320317,15.3241,361.066
2,1,CUTLASS,conv2d,cutlass_simt_sfprop_optimized_64x128_8x2_nhwc_align1,passed,success,fprop,1,16,16,256,512,3,3,7,7,0,0,2,2,1,1,f32:nhwc,f32:nhwc,f32:nhwc,cross,optimized,1,0,serial,1,none,simt,f32,64,128,8,2,2,2,1,1,1,1,50,1024,5270528,115655680,21,0.304824,16.1029,379.418
3,1,CUTLASS,conv2d,cutlass_simt_sfprop_optimized_64x64_8x2_nhwc_align1,passed,success,fprop,1,16,16,256,512,3,3,7,7,0,0,2,2,1,1,f32:nhwc,f32:nhwc,f32:nhwc,cross,optimized,1,0,serial,1,none,simt,f32,64,64,8,2,2,1,1,1,1,1,50,1024,5270528,115655680,21,0.283156,17.3352,408.451
4,1,CUTLASS,conv2d,cutlass_simt_sfprop_optimized_128x32_8x2_nhwc_align1,passed,success,fprop,1,16,16,256,512,3,3,7,7,0,0,2,2,1,1,f32:nhwc,f32:nhwc,f32:nhwc,cross,optimized,1,0,serial,1,none,simt,f32,128,32,8,2,2,1,1,1,1,1,50,1024,5270528,115655680,21,0.382863,12.8207,302.081
5,1,CUTLASS,conv2d,cutlass_simt_sfprop_optimized_32x128_8x2_nhwc_align1,passed,success,fprop,1,16,16,256,512,3,3,7,7,0,0,2,2,1,1,f32:nhwc,f32:nhwc,f32:nhwc,cross,optimized,1,0,serial,1,none,simt,f32,32,128,8,2,1,2,1,1,1,1,50,1024,5270528,115655680,21,0.297667,16.4901,388.541
0,1,CUTLASS,conv2d,cutlass_simt_sfprop_optimized_128x128_8x2_nhwc_align1,passed,success,fprop,1,9,9,512,512,3,3,7,7,0,0,1,1,1,1,f32:nhwc,f32:nhwc,f32:nhwc,cross,optimized,1,0,serial,1,none,simt,f32,128,128,8,2,4,2,1,1,1,1,50,1024,10440704,231261184,22,1.05139,9.24837,219.957
1,1,CUTLASS,conv2d,cutlass_simt_sfprop_optimized_128x64_8x2_nhwc_align1,passed,success,fprop,1,9,9,512,512,3,3,7,7,0,0,1,1,1,1,f32:nhwc,f32:nhwc,f32:nhwc,cross,optimized,1,0,serial,1,none,simt,f32,128,64,8,2,2,2,1,1,1,1,50,1024,10440704,231261184,22,0.583834,16.6549,396.108
2,1,CUTLASS,conv2d,cutlass_simt_sfprop_optimized_64x128_8x2_nhwc_align1,passed,success,fprop,1,9,9,512,512,3,3,7,7,0,0,1,1,1,1,f32:nhwc,f32:nhwc,f32:nhwc,cross,optimized,1,0,serial,1,none,simt,f32,64,128,8,2,2,2,1,1,1,1,50,1024,10440704,231261184,22,0.553943,17.5535,417.482
3,1,CUTLASS,conv2d,cutlass_simt_sfprop_optimized_64x64_8x2_nhwc_align1,passed,success,fprop,1,9,9,512,512,3,3,7,7,0,0,1,1,1,1,f32:nhwc,f32:nhwc,f32:nhwc,cross,optimized,1,0,serial,1,none,simt,f32,64,64,8,2,2,1,1,1,1,1,50,1024,10440704,231261184,22,0.549622,17.6916,420.764
4,1,CUTLASS,conv2d,cutlass_simt_sfprop_optimized_128x32_8x2_nhwc_align1,passed,success,fprop,1,9,9,512,512,3,3,7,7,0,0,1,1,1,1,f32:nhwc,f32:nhwc,f32:nhwc,cross,optimized,1,0,serial,1,none,simt,f32,128,32,8,2,2,1,1,1,1,1,50,1024,10440704,231261184,22,0.745124,13.0497,310.366
5,1,CUTLASS,conv2d,cutlass_simt_sfprop_optimized_32x128_8x2_nhwc_align1,passed,success,fprop,1,9,9,512,512,3,3,7,7,0,0,1,1,1,1,f32:nhwc,f32:nhwc,f32:nhwc,cross,optimized,1,0,serial,1,none,simt,f32,32,128,8,2,1,2,1,1,1,1,50,1024,10440704,231261184,22,0.590479,16.4674,391.65
0,1,CUTLASS,conv2d,cutlass_simt_sfprop_optimized_128x128_8x2_nhwc_align1,passed,success,fprop,1,58,58,64,64,3,3,56,56,0,0,1,1,1,1,f32:nhwc,f32:nhwc,f32:nhwc,cross,optimized,1,0,serial,1,none,simt,f32,128,128,8,2,4,2,1,1,1,1,50,1024,8175616,231612416,28,0.140943,54.0228,1643.31
1,1,CUTLASS,conv2d,cutlass_simt_sfprop_optimized_128x64_8x2_nhwc_align1,passed,success,fprop,1,58,58,64,64,3,3,56,56,0,0,1,1,1,1,f32:nhwc,f32:nhwc,f32:nhwc,cross,optimized,1,0,serial,1,none,simt,f32,128,64,8,2,2,2,1,1,1,1,50,1024,8175616,231612416,28,0.086487,88.0379,2678.0
2,1,CUTLASS,conv2d,cutlass_simt_sfprop_optimized_64x128_8x2_nhwc_align1,passed,success,fprop,1,58,58,64,64,3,3,56,56,0,0,1,1,1,1,f32:nhwc,f32:nhwc,f32:nhwc,cross,optimized,1,0,serial,1,none,simt,f32,64,128,8,2,2,2,1,1,1,1,50,1024,8175616,231612416,28,0.0817562,93.1323,2832.97
3,1,CUTLASS,conv2d,cutlass_simt_sfprop_optimized_64x64_8x2_nhwc_align1,passed,success,fprop,1,58,58,64,64,3,3,56,56,0,0,1,1,1,1,f32:nhwc,f32:nhwc,f32:nhwc,cross,optimized,1,0,serial,1,none,simt,f32,64,64,8,2,2,1,1,1,1,1,50,1024,8175616,231612416,28,0.0834461,91.2462,2775.59
4,1,CUTLASS,conv2d,cutlass_simt_sfprop_optimized_128x32_8x2_nhwc_align1,passed,success,fprop,1,58,58,64,64,3,3,56,56,0,0,1,1,1,1,f32:nhwc,f32:nhwc,f32:nhwc,cross,optimized,1,0,serial,1,none,simt,f32,128,32,8,2,2,1,1,1,1,1,50,1024,8175616,231612416,28,0.103885,73.294,2229.51
5,1,CUTLASS,conv2d,cutlass_simt_sfprop_optimized_32x128_8x2_nhwc_align1,passed,success,fprop,1,58,58,64,64,3,3,56,56,0,0,1,1,1,1,f32:nhwc,f32:nhwc,f32:nhwc,cross,optimized,1,0,serial,1,none,simt,f32,32,128,8,2,1,2,1,1,1,1,50,1024,8175616,231612416,28,0.148316,51.3372,1561.61
0,1,CUTLASS,conv2d,cutlass_simt_sfprop_optimized_128x128_8x2_nhwc_align1,passed,success,fprop,1,58,58,64,128,3,3,28,28,0,0,2,2,1,1,f32:nhwc,f32:nhwc,f32:nhwc,cross,optimized,1,0,serial,1,none,simt,f32,128,128,8,2,4,2,1,1,1,1,50,1024,2502656,115806208,46,0.14123,16.5034,819.983
1,1,CUTLASS,conv2d,cutlass_simt_sfprop_optimized_128x64_8x2_nhwc_align1,passed,success,fprop,1,58,58,64,128,3,3,28,28,0,0,2,2,1,1,f32:nhwc,f32:nhwc,f32:nhwc,cross,optimized,1,0,serial,1,none,simt,f32,128,64,8,2,2,2,1,1,1,1,50,1024,2502656,115806208,46,0.0866918,26.8858,1335.84
2,1,CUTLASS,conv2d,cutlass_simt_sfprop_optimized_64x128_8x2_nhwc_align1,passed,success,fprop,1,58,58,64,128,3,3,28,28,0,0,2,2,1,1,f32:nhwc,f32:nhwc,f32:nhwc,cross,optimized,1,0,serial,1,none,simt,f32,64,128,8,2,2,2,1,1,1,1,50,1024,2502656,115806208,46,0.0817869,28.4982,1415.95
3,1,CUTLASS,conv2d,cutlass_simt_sfprop_optimized_64x64_8x2_nhwc_align1,passed,success,fprop,1,58,58,64,128,3,3,28,28,0,0,2,2,1,1,f32:nhwc,f32:nhwc,f32:nhwc,cross,optimized,1,0,serial,1,none,simt,f32,64,64,8,2,2,1,1,1,1,1,50,1024,2502656,115806208,46,0.0834458,27.9317,1387.8
4,1,CUTLASS,conv2d,cutlass_simt_sfprop_optimized_128x32_8x2_nhwc_align1,passed,success,fprop,1,58,58,64,128,3,3,28,28,0,0,2,2,1,1,f32:nhwc,f32:nhwc,f32:nhwc,cross,optimized,1,0,serial,1,none,simt,f32,128,32,8,2,2,1,1,1,1,1,50,1024,2502656,115806208,46,0.10412,22.3854,1112.23
5,1,CUTLASS,conv2d,cutlass_simt_sfprop_optimized_32x128_8x2_nhwc_align1,passed,success,fprop,1,58,58,64,128,3,3,28,28,0,0,2,2,1,1,f32:nhwc,f32:nhwc,f32:nhwc,cross,optimized,1,0,serial,1,none,simt,f32,32,128,8,2,1,2,1,1,1,1,50,1024,2502656,115806208,46,0.0886275,26.2986,1306.66
0,1,CUTLASS,conv2d,cutlass_simt_sfprop_optimized_128x128_8x2_nhwc_align1,passed,success,fprop,1,30,30,128,128,3,3,28,28,0,0,1,1,1,1,f32:nhwc,f32:nhwc,f32:nhwc,cross,optimized,1,0,serial,1,none,simt,f32,128,128,8,2,4,2,1,1,1,1,50,1024,4603904,231411712,50,0.27434,15.6292,843.522
1,1,CUTLASS,conv2d,cutlass_simt_sfprop_optimized_128x64_8x2_nhwc_align1,passed,success,fprop,1,30,30,128,128,3,3,28,28,0,0,1,1,1,1,f32:nhwc,f32:nhwc,f32:nhwc,cross,optimized,1,0,serial,1,none,simt,f32,128,64,8,2,2,2,1,1,1,1,50,1024,4603904,231411712,50,0.164465,26.0707,1407.06
2,1,CUTLASS,conv2d,cutlass_simt_sfprop_optimized_64x128_8x2_nhwc_align1,passed,success,fprop,1,30,30,128,128,3,3,28,28,0,0,1,1,1,1,f32:nhwc,f32:nhwc,f32:nhwc,cross,optimized,1,0,serial,1,none,simt,f32,64,128,8,2,2,2,1,1,1,1,50,1024,4603904,231411712,50,0.155515,27.5711,1488.04
3,1,CUTLASS,conv2d,cutlass_simt_sfprop_optimized_64x64_8x2_nhwc_align1,passed,success,fprop,1,30,30,128,128,3,3,28,28,0,0,1,1,1,1,f32:nhwc,f32:nhwc,f32:nhwc,cross,optimized,1,0,serial,1,none,simt,f32,64,64,8,2,2,1,1,1,1,1,50,1024,4603904,231411712,50,0.158351,27.0773,1461.38
4,1,CUTLASS,conv2d,cutlass_simt_sfprop_optimized_128x32_8x2_nhwc_align1,passed,success,fprop,1,30,30,128,128,3,3,28,28,0,0,1,1,1,1,f32:nhwc,f32:nhwc,f32:nhwc,cross,optimized,1,0,serial,1,none,simt,f32,128,32,8,2,2,1,1,1,1,1,50,1024,4603904,231411712,50,0.197581,21.7011,1171.23
5,1,CUTLASS,conv2d,cutlass_simt_sfprop_optimized_32x128_8x2_nhwc_align1,passed,success,fprop,1,30,30,128,128,3,3,28,28,0,0,1,1,1,1,f32:nhwc,f32:nhwc,f32:nhwc,cross,optimized,1,0,serial,1,none,simt,f32,32,128,8,2,1,2,1,1,1,1,50,1024,4603904,231411712,50,0.169411,25.3096,1365.98
0,1,CUTLASS,conv2d,cutlass_simt_sfprop_optimized_128x128_8x2_nhwc_align1,passed,success,fprop,1,30,30,128,256,3,3,14,14,0,0,2,2,1,1,f32:nhwc,f32:nhwc,f32:nhwc,cross,optimized,1,0,serial,1,none,simt,f32,128,128,8,2,4,2,1,1,1,1,50,1024,2283520,115705856,50,0.274237,7.75494,421.919
1,1,CUTLASS,conv2d,cutlass_simt_sfprop_optimized_128x64_8x2_nhwc_align1,passed,success,fprop,1,30,30,128,256,3,3,14,14,0,0,2,2,1,1,f32:nhwc,f32:nhwc,f32:nhwc,cross,optimized,1,0,serial,1,none,simt,f32,128,64,8,2,2,2,1,1,1,1,50,1024,2283520,115705856,50,0.164618,12.9189,702.874
2,1,CUTLASS,conv2d,cutlass_simt_sfprop_optimized_64x128_8x2_nhwc_align1,passed,success,fprop,1,30,30,128,256,3,3,14,14,0,0,2,2,1,1,f32:nhwc,f32:nhwc,f32:nhwc,cross,optimized,1,0,serial,1,none,simt,f32,64,128,8,2,2,2,1,1,1,1,50,1024,2283520,115705856,50,0.155525,13.6743,743.97
3,1,CUTLASS,conv2d,cutlass_simt_sfprop_optimized_64x64_8x2_nhwc_align1,passed,success,fprop,1,30,30,128,256,3,3,14,14,0,0,2,2,1,1,f32:nhwc,f32:nhwc,f32:nhwc,cross,optimized,1,0,serial,1,none,simt,f32,64,64,8,2,2,1,1,1,1,1,50,1024,2283520,115705856,50,0.15831,13.4337,730.88
4,1,CUTLASS,conv2d,cutlass_simt_sfprop_optimized_128x32_8x2_nhwc_align1,passed,success,fprop,1,30,30,128,256,3,3,14,14,0,0,2,2,1,1,f32:nhwc,f32:nhwc,f32:nhwc,cross,optimized,1,0,serial,1,none,simt,f32,128,32,8,2,2,1,1,1,1,1,50,1024,2283520,115705856,50,0.205466,10.3506,563.14
5,1,CUTLASS,conv2d,cutlass_simt_sfprop_optimized_32x128_8x2_nhwc_align1,passed,success,fprop,1,30,30,128,256,3,3,14,14,0,0,2,2,1,1,f32:nhwc,f32:nhwc,f32:nhwc,cross,optimized,1,0,serial,1,none,simt,f32,32,128,8,2,1,2,1,1,1,1,50,1024,2283520,115705856,50,0.1694,12.5542,683.032
0,1,CUTLASS,conv2d,cutlass_simt_sfprop_optimized_128x128_8x2_nhwc_align1,passed,success,fprop,1,16,16,256,256,3,3,14,14,0,0,1,1,1,1,f32:nhwc,f32:nhwc,f32:nhwc,cross,optimized,1,0,serial,1,none,simt,f32,128,128,8,2,4,2,1,1,1,1,50,1024,4366336,231311360,52,0.540426,7.52456,428.017
1,1,CUTLASS,conv2d,cutlass_simt_sfprop_optimized_128x64_8x2_nhwc_align1,passed,success,fprop,1,16,16,256,256,3,3,14,14,0,0,1,1,1,1,f32:nhwc,f32:nhwc,f32:nhwc,cross,optimized,1,0,serial,1,none,simt,f32,128,64,8,2,2,2,1,1,1,1,50,1024,4366336,231311360,52,0.320358,12.6935,722.039
2,1,CUTLASS,conv2d,cutlass_simt_sfprop_optimized_64x128_8x2_nhwc_align1,passed,success,fprop,1,16,16,256,256,3,3,14,14,0,0,1,1,1,1,f32:nhwc,f32:nhwc,f32:nhwc,cross,optimized,1,0,serial,1,none,simt,f32,64,128,8,2,2,2,1,1,1,1,50,1024,4366336,231311360,52,0.303206,13.4115,762.884
3,1,CUTLASS,conv2d,cutlass_simt_sfprop_optimized_64x64_8x2_nhwc_align1,passed,success,fprop,1,16,16,256,256,3,3,14,14,0,0,1,1,1,1,f32:nhwc,f32:nhwc,f32:nhwc,cross,optimized,1,0,serial,1,none,simt,f32,64,64,8,2,2,1,1,1,1,1,50,1024,4366336,231311360,52,0.281907,14.4248,820.523
4,1,CUTLASS,conv2d,cutlass_simt_sfprop_optimized_128x32_8x2_nhwc_align1,passed,success,fprop,1,16,16,256,256,3,3,14,14,0,0,1,1,1,1,f32:nhwc,f32:nhwc,f32:nhwc,cross,optimized,1,0,serial,1,none,simt,f32,128,32,8,2,2,1,1,1,1,1,50,1024,4366336,231311360,52,0.371876,10.935,622.012
5,1,CUTLASS,conv2d,cutlass_simt_sfprop_optimized_32x128_8x2_nhwc_align1,passed,success,fprop,1,16,16,256,256,3,3,14,14,0,0,1,1,1,1,f32:nhwc,f32:nhwc,f32:nhwc,cross,optimized,1,0,serial,1,none,simt,f32,32,128,8,2,1,2,1,1,1,1,50,1024,4366336,231311360,52,0.298721,13.6129,774.338
0,1,CUTLASS,conv2d,cutlass_simt_sfprop_optimized_128x128_8x2_nhwc_align1,passed,success,fprop,1,546,546,3,32,3,3,544,544,0,0,1,1,1,1,f32:nhwc,f32:nhwc,f32:nhwc,cross,optimized,1,0,serial,1,none,simt,f32,128,128,8,2,4,2,1,1,1,1,50,1024,69844352,530317312,7,0.630036,103.244,841.725
1,1,CUTLASS,conv2d,cutlass_simt_sfprop_optimized_128x64_8x2_nhwc_align1,passed,success,fprop,1,546,546,3,32,3,3,544,544,0,0,1,1,1,1,f32:nhwc,f32:nhwc,f32:nhwc,cross,optimized,1,0,serial,1,none,simt,f32,128,64,8,2,2,2,1,1,1,1,50,1024,69844352,530317312,7,0.297902,218.352,1780.17
2,1,CUTLASS,conv2d,cutlass_simt_sfprop_optimized_64x128_8x2_nhwc_align1,passed,success,fprop,1,546,546,3,32,3,3,544,544,0,0,1,1,1,1,f32:nhwc,f32:nhwc,f32:nhwc,cross,optimized,1,0,serial,1,none,simt,f32,64,128,8,2,2,2,1,1,1,1,50,1024,69844352,530317312,7,0.543365,119.713,975.987
3,1,CUTLASS,conv2d,cutlass_simt_sfprop_optimized_64x64_8x2_nhwc_align1,passed,success,fprop,1,546,546,3,32,3,3,544,544,0,0,1,1,1,1,f32:nhwc,f32:nhwc,f32:nhwc,cross,optimized,1,0,serial,1,none,simt,f32,64,64,8,2,2,1,1,1,1,1,50,1024,69844352,530317312,7,0.331704,196.101,1598.77
4,1,CUTLASS,conv2d,cutlass_simt_sfprop_optimized_128x32_8x2_nhwc_align1,passed,success,fprop,1,546,546,3,32,3,3,544,544,0,0,1,1,1,1,f32:nhwc,f32:nhwc,f32:nhwc,cross,optimized,1,0,serial,1,none,simt,f32,128,32,8,2,2,1,1,1,1,1,50,1024,69844352,530317312,7,0.196731,330.643,2695.65
5,1,CUTLASS,conv2d,cutlass_simt_sfprop_optimized_32x128_8x2_nhwc_align1,passed,success,fprop,1,546,546,3,32,3,3,544,544,0,0,1,1,1,1,f32:nhwc,f32:nhwc,f32:nhwc,cross,optimized,1,0,serial,1,none,simt,f32,32,128,8,2,1,2,1,1,1,1,50,1024,69844352,530317312,7,0.620319,104.862,854.911
0,1,CUTLASS,conv2d,cutlass_simt_sfprop_optimized_128x128_8x2_nhwc_align1,passed,success,fprop,1,274,274,32,64,3,3,272,272,0,0,1,1,1,1,f32:nhwc,f32:nhwc,f32:nhwc,cross,optimized,1,0,serial,1,none,simt,f32,128,128,8,2,4,2,1,1,1,1,50,1024,104243200,2736816128,26,0.581304,167.011,4708.06
1,1,CUTLASS,conv2d,cutlass_simt_sfprop_optimized_128x64_8x2_nhwc_align1,passed,success,fprop,1,274,274,32,64,3,3,272,272,0,0,1,1,1,1,f32:nhwc,f32:nhwc,f32:nhwc,cross,optimized,1,0,serial,1,none,simt,f32,128,64,8,2,2,2,1,1,1,1,50,1024,104243200,2736816128,26,0.27778,349.499,9852.44
2,1,CUTLASS,conv2d,cutlass_simt_sfprop_optimized_64x128_8x2_nhwc_align1,passed,success,fprop,1,274,274,32,64,3,3,272,272,0,0,1,1,1,1,f32:nhwc,f32:nhwc,f32:nhwc,cross,optimized,1,0,serial,1,none,simt,f32,64,128,8,2,2,2,1,1,1,1,50,1024,104243200,2736816128,26,0.488684,198.664,5600.39
3,1,CUTLASS,conv2d,cutlass_simt_sfprop_optimized_64x64_8x2_nhwc_align1,passed,success,fprop,1,274,274,32,64,3,3,272,272,0,0,1,1,1,1,f32:nhwc,f32:nhwc,f32:nhwc,cross,optimized,1,0,serial,1,none,simt,f32,64,64,8,2,2,1,1,1,1,1,50,1024,104243200,2736816128,26,0.299018,324.676,9152.67
4,1,CUTLASS,conv2d,cutlass_simt_sfprop_optimized_128x32_8x2_nhwc_align1,passed,success,fprop,1,274,274,32,64,3,3,272,272,0,0,1,1,1,1,f32:nhwc,f32:nhwc,f32:nhwc,cross,optimized,1,0,serial,1,none,simt,f32,128,32,8,2,2,1,1,1,1,1,50,1024,104243200,2736816128,26,0.316334,306.904,8651.66
5,1,CUTLASS,conv2d,cutlass_simt_sfprop_optimized_32x128_8x2_nhwc_align1,passed,success,fprop,1,274,274,32,64,3,3,272,272,0,0,1,1,1,1,f32:nhwc,f32:nhwc,f32:nhwc,cross,optimized,1,0,serial,1,none,simt,f32,32,128,8,2,1,2,1,1,1,1,50,1024,104243200,2736816128,26,0.545157,178.085,5020.23
0,1,CUTLASS,conv2d,cutlass_simt_sfprop_optimized_128x128_8x2_nhwc_align1,passed,success,fprop,1,138,138,64,128,3,3,136,136,0,0,1,1,1,1,f32:nhwc,f32:nhwc,f32:nhwc,cross,optimized,1,0,serial,1,none,simt,f32,128,128,8,2,4,2,1,1,1,1,50,1024,52379648,2732081152,52,0.288399,169.149,9473.26
1,1,CUTLASS,conv2d,cutlass_simt_sfprop_optimized_128x64_8x2_nhwc_align1,passed,success,fprop,1,138,138,64,128,3,3,136,136,0,0,1,1,1,1,f32:nhwc,f32:nhwc,f32:nhwc,cross,optimized,1,0,serial,1,none,simt,f32,128,64,8,2,2,2,1,1,1,1,50,1024,52379648,2732081152,52,0.29442,165.689,9279.52
2,1,CUTLASS,conv2d,cutlass_simt_sfprop_optimized_64x128_8x2_nhwc_align1,passed,success,fprop,1,138,138,64,128,3,3,136,136,0,0,1,1,1,1,f32:nhwc,f32:nhwc,f32:nhwc,cross,optimized,1,0,serial,1,none,simt,f32,64,128,8,2,2,2,1,1,1,1,50,1024,52379648,2732081152,52,0.285072,171.123,9583.84
3,1,CUTLASS,conv2d,cutlass_simt_sfprop_optimized_64x64_8x2_nhwc_align1,passed,success,fprop,1,138,138,64,128,3,3,136,136,0,0,1,1,1,1,f32:nhwc,f32:nhwc,f32:nhwc,cross,optimized,1,0,serial,1,none,simt,f32,64,64,8,2,2,1,1,1,1,1,50,1024,52379648,2732081152,52,0.303647,160.655,8997.57
4,1,CUTLASS,conv2d,cutlass_simt_sfprop_optimized_128x32_8x2_nhwc_align1,passed,success,fprop,1,138,138,64,128,3,3,136,136,0,0,1,1,1,1,f32:nhwc,f32:nhwc,f32:nhwc,cross,optimized,1,0,serial,1,none,simt,f32,128,32,8,2,2,1,1,1,1,1,50,1024,52379648,2732081152,52,0.329892,147.874,8281.75
5,1,CUTLASS,conv2d,cutlass_simt_sfprop_optimized_32x128_8x2_nhwc_align1,passed,success,fprop,1,138,138,64,128,3,3,136,136,0,0,1,1,1,1,f32:nhwc,f32:nhwc,f32:nhwc,cross,optimized,1,0,serial,1,none,simt,f32,32,128,8,2,1,2,1,1,1,1,50,1024,52379648,2732081152,52,0.297994,163.702,9168.24
0,1,CUTLASS,conv2d,cutlass_simt_sfprop_optimized_128x128_8x2_nhwc_align1,passed,success,fprop,1,70,70,128,256,3,3,68,68,0,0,1,1,1,1,f32:nhwc,f32:nhwc,f32:nhwc,cross,optimized,1,0,serial,1,none,simt,f32,128,128,8,2,4,2,1,1,1,1,50,1024,27222016,2729713664,100,0.278416,91.0598,9804.45
1,1,CUTLASS,conv2d,cutlass_simt_sfprop_optimized_128x64_8x2_nhwc_align1,passed,success,fprop,1,70,70,128,256,3,3,68,68,0,0,1,1,1,1,f32:nhwc,f32:nhwc,f32:nhwc,cross,optimized,1,0,serial,1,none,simt,f32,128,64,8,2,2,2,1,1,1,1,50,1024,27222016,2729713664,100,0.288205,87.9669,9471.44
2,1,CUTLASS,conv2d,cutlass_simt_sfprop_optimized_64x128_8x2_nhwc_align1,passed,success,fprop,1,70,70,128,256,3,3,68,68,0,0,1,1,1,1,f32:nhwc,f32:nhwc,f32:nhwc,cross,optimized,1,0,serial,1,none,simt,f32,64,128,8,2,2,2,1,1,1,1,50,1024,27222016,2729713664,100,0.27989,90.5801,9752.8
3,1,CUTLASS,conv2d,cutlass_simt_sfprop_optimized_64x64_8x2_nhwc_align1,passed,success,fprop,1,70,70,128,256,3,3,68,68,0,0,1,1,1,1,f32:nhwc,f32:nhwc,f32:nhwc,cross,optimized,1,0,serial,1,none,simt,f32,64,64,8,2,2,1,1,1,1,1,50,1024,27222016,2729713664,100,0.314573,80.5933,8677.52
4,1,CUTLASS,conv2d,cutlass_simt_sfprop_optimized_128x32_8x2_nhwc_align1,passed,success,fprop,1,70,70,128,256,3,3,68,68,0,0,1,1,1,1,f32:nhwc,f32:nhwc,f32:nhwc,cross,optimized,1,0,serial,1,none,simt,f32,128,32,8,2,2,1,1,1,1,1,50,1024,27222016,2729713664,100,0.348559,72.735,7831.42
5,1,CUTLASS,conv2d,cutlass_simt_sfprop_optimized_32x128_8x2_nhwc_align1,passed,success,fprop,1,70,70,128,256,3,3,68,68,0,0,1,1,1,1,f32:nhwc,f32:nhwc,f32:nhwc,cross,optimized,1,0,serial,1,none,simt,f32,32,128,8,2,1,2,1,1,1,1,50,1024,27222016,2729713664,100,0.290468,87.2814,9397.63
0,1,CUTLASS,conv2d,cutlass_simt_sfprop_optimized_128x128_8x2_nhwc_align1,passed,success,fprop,1,36,36,256,512,3,3,34,34,0,0,1,1,1,1,f32:nhwc,f32:nhwc,f32:nhwc,cross,optimized,1,0,serial,1,none,simt,f32,128,128,8,2,4,2,1,1,1,1,50,1024,17739776,2728529920,153,0.541942,30.4856,5034.73
1,1,CUTLASS,conv2d,cutlass_simt_sfprop_optimized_128x64_8x2_nhwc_align1,passed,success,fprop,1,36,36,256,512,3,3,34,34,0,0,1,1,1,1,f32:nhwc,f32:nhwc,f32:nhwc,cross,optimized,1,0,serial,1,none,simt,f32,128,64,8,2,2,2,1,1,1,1,50,1024,17739776,2728529920,153,0.317194,52.0862,8602.08
2,1,CUTLASS,conv2d,cutlass_simt_sfprop_optimized_64x128_8x2_nhwc_align1,passed,success,fprop,1,36,36,256,512,3,3,34,34,0,0,1,1,1,1,f32:nhwc,f32:nhwc,f32:nhwc,cross,optimized,1,0,serial,1,none,simt,f32,64,128,8,2,2,2,1,1,1,1,50,1024,17739776,2728529920,153,0.302285,54.6553,9026.36
3,1,CUTLASS,conv2d,cutlass_simt_sfprop_optimized_64x64_8x2_nhwc_align1,passed,success,fprop,1,36,36,256,512,3,3,34,34,0,0,1,1,1,1,f32:nhwc,f32:nhwc,f32:nhwc,cross,optimized,1,0,serial,1,none,simt,f32,64,64,8,2,2,1,1,1,1,1,50,1024,17739776,2728529920,153,0.503818,32.7925,5415.7
4,1,CUTLASS,conv2d,cutlass_simt_sfprop_optimized_128x32_8x2_nhwc_align1,passed,success,fprop,1,36,36,256,512,3,3,34,34,0,0,1,1,1,1,f32:nhwc,f32:nhwc,f32:nhwc,cross,optimized,1,0,serial,1,none,simt,f32,128,32,8,2,2,1,1,1,1,1,50,1024,17739776,2728529920,153,0.527063,31.3463,5176.86
5,1,CUTLASS,conv2d,cutlass_simt_sfprop_optimized_32x128_8x2_nhwc_align1,passed,success,fprop,1,36,36,256,512,3,3,34,34,0,0,1,1,1,1,f32:nhwc,f32:nhwc,f32:nhwc,cross,optimized,1,0,serial,1,none,simt,f32,32,128,8,2,1,2,1,1,1,1,50,1024,17739776,2728529920,153,0.501309,32.9566,5442.81
0,1,CUTLASS,conv2d,cutlass_simt_sfprop_optimized_128x128_8x2_nhwc_align1,passed,success,fprop,1,19,19,512,1024,3,3,17,17,0,0,1,1,1,1,f32:nhwc,f32:nhwc,f32:nhwc,cross,optimized,1,0,serial,1,none,simt,f32,128,128,8,2,4,2,1,1,1,1,50,1024,25384960,2727938048,107,1.05246,22.4632,2591.97
1,1,CUTLASS,conv2d,cutlass_simt_sfprop_optimized_128x64_8x2_nhwc_align1,passed,success,fprop,1,19,19,512,1024,3,3,17,17,0,0,1,1,1,1,f32:nhwc,f32:nhwc,f32:nhwc,cross,optimized,1,0,serial,1,none,simt,f32,128,64,8,2,2,2,1,1,1,1,50,1024,25384960,2727938048,107,0.590295,40.0505,4621.31
2,1,CUTLASS,conv2d,cutlass_simt_sfprop_optimized_64x128_8x2_nhwc_align1,passed,success,fprop,1,19,19,512,1024,3,3,17,17,0,0,1,1,1,1,f32:nhwc,f32:nhwc,f32:nhwc,cross,optimized,1,0,serial,1,none,simt,f32,64,128,8,2,2,2,1,1,1,1,50,1024,25384960,2727938048,107,0.557885,42.3771,4889.78
3,1,CUTLASS,conv2d,cutlass_simt_sfprop_optimized_64x64_8x2_nhwc_align1,passed,success,fprop,1,19,19,512,1024,3,3,17,17,0,0,1,1,1,1,f32:nhwc,f32:nhwc,f32:nhwc,cross,optimized,1,0,serial,1,none,simt,f32,64,64,8,2,2,1,1,1,1,1,50,1024,25384960,2727938048,107,0.554947,42.6016,4915.68
4,1,CUTLASS,conv2d,cutlass_simt_sfprop_optimized_128x32_8x2_nhwc_align1,passed,success,fprop,1,19,19,512,1024,3,3,17,17,0,0,1,1,1,1,f32:nhwc,f32:nhwc,f32:nhwc,cross,optimized,1,0,serial,1,none,simt,f32,128,32,8,2,2,1,1,1,1,1,50,1024,25384960,2727938048,107,1.0459,22.604,2608.21
5,1,CUTLASS,conv2d,cutlass_simt_sfprop_optimized_32x128_8x2_nhwc_align1,passed,success,fprop,1,19,19,512,1024,3,3,17,17,0,0,1,1,1,1,f32:nhwc,f32:nhwc,f32:nhwc,cross,optimized,1,0,serial,1,none,simt,f32,32,128,8,2,1,2,1,1,1,1,50,1024,25384960,2727938048,107,0.588677,40.1605,4634.01
